timestamp,site_id,consumption_mw,voltage_v,frequency_hz,status
2025-01-03T04:30:00,SITE_IND_002,0.865,234.6,49.89,OK
2025-01-22 01:00:00,SITE_IND_001,1.224,229.0,49.85,OK
2025-01-11T13:30:00,SITE_RES_001,0.149,223.5,49.65,OK
17/01/2025 18:15:00,SITE_COM_001,1.105,219.6,50.16,OK
2025-01-27T00:00:00,SITE_COM_001,,234.8,50.25,ERROR
2025-01-11 05:15:00,SITE_COM_001,0.172,246.1,50.24,OK
2025-01-09T19:30:00,SITE_IND_001,3.321,229.3,50.01,OK
2025-01-15T22:00:00,SITE_COM_001,0.164,241.4,49.88,OK
2025-01-22T12:30:00,SITE_COM_001,1.116,232.7,49.76,OK
2025-01-25T05:15:00,SITE_COM_001,0.166,228.6,49.62,OK
2025-01-17 21:00:00,SITE_COM_002,0.147,220.0,50.09,OK
2025-01-18 20:30:00,SITE_IND_002,1.067,237.8,49.98,OK
25/01/2025 10:30:00,SITE_IND_002,0.996,232.8,50.12,OK
2025-01-16T00:45:00,SITE_IND_001,1.484,218.9,50.23,OK
2025-01-30 06:00:00,SITE_IND_002,2.56,213.9,49.63,OK
2025-01-25 04:45:00,SITE_RES_001,0.16,213.9,49.95,OK
2025-01-07 05:00:00,SITE_IND_002,-888.0,224.8,49.89,ERROR
2025-01-18 11:45:00,SITE_IND_001,,217.1,49.29,ERROR
2025-01-02 22:30:00,SITE_COM_002,0.102,234.6,49.8,OK
2025-01-28T11:15:00,SITE_COM_002,0.667,224.1,49.64,OK
22/01/2025 16:00:00,SITE_IND_002,2.623,229.1,50.03,OK
25/01/2025 20:00:00,SITE_IND_002,1.184,231.7,49.86,OK
2025-01-13 12:00:00,SITE_IND_001,3.712,221.7,49.97,OK
19/01/2025 22:15:00,SITE_RES_002,0.1,239.8,50.07,OK
2025-01-01T10:15:00,SITE_RES_002,0.139,220.5,50.53,OK
2025-01-13T07:15:00,SITE_COM_002,0.167,243.1,50.19,OK
2025-01-06T11:45:00,SITE_COM_002,0.737,242.4,50.15,OK
2025-01-24T20:00:00,SITE_COM_001,0.226,215.4,50.25,OK
2025-01-26T05:00:00,SITE_RES_001,0.165,253.3,50.2,OK
2025-01-13T16:30:00,SITE_IND_001,-777.0,220.4,50.09,ERROR
05/01/2025 07:30:00,SITE_IND_002,0.885,220.9,50.15,OK
2025-01-10T21:45:00,SITE_RES_002,0.114,230.2,50.07,OK
2025-01-11T14:30:00,SITE_IND_001,1.476,236.0,49.92,OK
2025-01-08 15:45:00,SITE_IND_001,2.657,231.7,50.08,OK
2025-01-14T03:15:00,SITE_RES_002,0.135,227.9,50.16,OK
22/01/2025 19:30:00,SITE_COM_002,1.078,225.2,49.8,OK
10/01/2025 09:45:00,SITE_COM_001,1.488,238.6,49.93,OK
2025-01-28T06:00:00,SITE_RES_001,0.132,220.9,50.25,OK
20/01/2025 14:45:00,SITE_IND_002,2.212,230.4,50.01,OK
2025-01-22T13:15:00,SITE_COM_001,-777.0,235.2,50.32,ERROR
2025-01-28T09:45:00,SITE_IND_001,3.964,225.6,50.15,OK
2025-01-13T22:00:00,SITE_COM_002,0.146,221.3,49.92,OK
16/01/2025 06:00:00,SITE_COM_001,0.175,238.1,49.93,OK
2025-01-26T04:30:00,SITE_IND_001,1.469,243.2,50.16,OK
2025-01-17T14:30:00,SITE_IND_001,3.9,216.5,49.76,OK
05/01/2025 17:45:00,SITE_IND_001,1.636,225.9,49.99,OK
29/01/2025 10:00:00,SITE_RES_001,0.165,228.2,49.82,OK
2025-01-12T19:15:00,SITE_IND_001,1.347,242.1,50.47,OK
2025-01-25 01:15:00,SITE_IND_001,-888.0,222.4,49.91,ERROR
05/01/2025 14:45:00,SITE_RES_001,0.165,226.5,50.06,OK
29/01/2025 02:00:00,SITE_COM_002,0.148,236.3,50.16,OK
05/01/2025 06:00:00,SITE_IND_001,1.398,219.8,49.84,OK
2025-01-23T21:30:00,SITE_IND_001,3.618,217.2,49.89,OK
2025-01-27 09:30:00,SITE_COM_001,1.502,224.5,50.16,OK
2025-01-03T22:30:00,SITE_RES_002,0.107,216.1,50.34,OK
2025-01-03 19:30:00,SITE_RES_001,0.325,232.3,49.88,OK
06/01/2025 23:00:00,SITE_COM_001,0.257,220.3,50.05,OK
2025-01-20 22:45:00,SITE_IND_001,1.488,228.6,49.84,OK
2025-01-28T23:15:00,SITE_IND_002,0.882,222.5,49.97,OK
2025-01-27T19:15:00,SITE_RES_001,0.284,216.2,50.05,OK
29/01/2025 05:45:00,SITE_RES_002,0.095,231.0,49.95,OK
2025-01-02T21:00:00,SITE_RES_001,0.175,240.6,50.07,OK
2025-01-19T01:15:00,SITE_IND_002,0.719,233.5,49.85,OK
2025-01-03T07:00:00,SITE_IND_002,2.733,223.9,50.07,OK
04/01/2025 21:00:00,SITE_IND_001,1.724,241.3,49.77,OK
2025-01-11T21:45:00,SITE_RES_001,0.126,226.8,49.99,OK
2025-01-05T17:30:00,SITE_COM_001,1.336,227.5,49.35,OK
17/01/2025 06:45:00,SITE_RES_001,0.172,234.4,49.69,OK
27/01/2025 14:45:00,SITE_COM_002,0.864,235.1,50.03,OK
2025-01-02T21:15:00,SITE_IND_002,2.467,221.0,50.23,OK
2025-01-18T21:00:00,SITE_RES_001,0.159,227.0,49.9,OK
2025-01-05 22:00:00,SITE_RES_001,0.146,235.9,50.0,OK
2025-01-09T12:00:00,SITE_IND_001,4.132,224.5,50.06,OK
2025-01-07 11:45:00,SITE_IND_002,2.403,236.4,49.92,OK
2025-01-05T07:15:00,SITE_RES_002,0.289,225.4,50.1,OK
2025-01-11 20:30:00,SITE_IND_001,1.75,218.6,49.94,OK
2025-01-22T08:00:00,SITE_COM_002,0.801,221.7,50.29,OK
25/01/2025 08:30:00,SITE_RES_002,0.246,235.5,50.13,OK
2025-01-05T17:00:00,SITE_COM_001,0.94,225.3,50.22,OK
2025-01-28 08:30:00,SITE_IND_002,2.351,241.2,50.01,OK
2025-01-25T23:30:00,SITE_IND_002,1.201,228.6,49.58,OK
2025-01-13T16:45:00,SITE_COM_002,1.048,230.0,50.01,OK
2025-01-01T14:30:00,SITE_COM_002,0.935,224.5,49.87,OK
2025-01-08 06:45:00,SITE_COM_002,0.182,221.8,50.59,OK
2025-01-04 11:30:00,SITE_RES_001,0.152,231.2,50.21,OK
14/01/2025 23:15:00,SITE_IND_001,1.645,228.7,49.99,OK
05/01/2025 00:30:00,SITE_COM_002,0.191,256.7,50.02,OK
2025-01-05T08:45:00,SITE_COM_001,1.333,246.8,50.07,OK
2025-01-28 04:15:00,SITE_COM_001,0.218,222.9,49.88,OK
11/01/2025 17:30:00,SITE_IND_001,1.492,233.9,49.88,OK
15/01/2025 17:30:00,SITE_COM_002,0.993,226.8,50.42,OK
2025-01-10T10:00:00,SITE_COM_001,1.474,242.6,49.75,OK
2025-01-14 19:00:00,SITE_IND_002,2.74,239.4,50.09,OK
2025-01-18T21:30:00,SITE_RES_001,0.135,243.5,49.75,OK
2025-01-27 13:45:00,SITE_COM_002,,234.8,50.12,ERROR
2025-01-16 13:45:00,SITE_COM_002,0.923,241.6,49.76,OK
25/01/2025 12:45:00,SITE_IND_002,0.983,222.4,49.95,OK
17/01/2025 19:45:00,SITE_IND_002,2.236,218.6,50.14,OK
2025-01-11 00:15:00,SITE_IND_002,0.891,227.5,49.69,OK
09/01/2025 00:00:00,SITE_COM_001,0.215,232.7,50.0,OK
2025-01-06T15:45:00,SITE_RES_002,0.109,238.2,50.07,OK
2025-01-14T13:00:00,SITE_IND_001,3.677,223.5,50.09,OK
2025-01-14T22:30:00,SITE_IND_002,-888.0,236.5,50.34,ERROR
03/01/2025 00:15:00,SITE_RES_002,0.091,226.7,49.96,OK
18/01/2025 04:00:00,SITE_RES_002,0.121,249.9,50.03,OK
2025-01-23T18:45:00,SITE_IND_001,3.413,234.9,50.08,OK
2025-01-12 22:15:00,SITE_COM_001,0.2,231.3,49.58,OK
2025-01-16 13:30:00,SITE_COM_001,1.31,236.3,50.13,OK
15/01/2025 00:00:00,SITE_IND_002,0.819,231.5,49.83,OK
03/01/2025 14:00:00,SITE_RES_002,0.139,218.1,50.06,OK
2025-01-20 15:45:00,SITE_RES_002,0.089,236.3,49.94,OK
2025-01-15 15:15:00,SITE_IND_002,3.084,228.0,50.18,OK
2025-01-03 11:30:00,SITE_IND_002,2.518,245.1,50.12,OK
2025-01-01T13:30:00,SITE_COM_001,0.915,237.6,50.16,OK
2025-01-05T15:30:00,SITE_IND_002,1.287,244.1,50.16,OK
2025-01-28 23:45:00,SITE_COM_002,0.141,215.6,49.95,OK
14/01/2025 05:00:00,SITE_RES_002,0.107,211.8,50.11,OK
2025-01-12T19:45:00,SITE_IND_001,1.329,232.5,49.77,OK
16/01/2025 13:30:00,SITE_RES_002,0.121,230.0,50.13,OK
02/01/2025 10:00:00,SITE_RES_001,0.162,237.4,50.1,OK
2025-01-01T10:15:00,SITE_IND_002,1.98,223.8,50.01,OK
2025-01-06T09:15:00,SITE_RES_002,0.113,231.0,49.68,OK
2025-01-11T04:15:00,SITE_IND_002,1.209,241.0,49.99,OK
2025-01-28T16:30:00,SITE_IND_002,1.972,234.0,49.75,OK
2025-01-19 06:15:00,SITE_RES_001,0.139,221.5,49.92,OK
2025-01-19T08:45:00,SITE_RES_002,0.325,223.8,50.17,OK
2025-01-06T15:45:00,SITE_COM_001,1.118,240.7,49.78,OK
2025-01-23T20:15:00,SITE_COM_001,0.226,225.7,49.98,OK
2025-01-08T01:30:00,SITE_IND_002,1.143,243.0,49.78,OK
2025-01-27T14:45:00,SITE_IND_001,3.468,228.0,49.97,OK
2025-01-05T12:30:00,SITE_RES_002,0.116,231.9,49.77,OK
01/01/2025 20:00:00,SITE_RES_002,0.221,237.5,50.08,OK
27/01/2025 22:30:00,SITE_COM_002,2.791,222.8,50.39,OK
2025-01-28T01:00:00,SITE_RES_002,0.081,227.1,49.91,OK
2025-01-20T23:15:00,SITE_RES_001,0.135,253.2,49.85,OK
17/01/2025 00:30:00,SITE_RES_002,0.12,227.9,49.83,OK
2025-01-20 03:15:00,SITE_COM_002,0.218,220.2,49.94,OK
27/01/2025 09:45:00,SITE_RES_002,0.092,250.3,50.48,OK
2025-01-06 08:00:00,SITE_RES_002,0.329,230.7,49.97,OK
2025-01-16T15:00:00,SITE_RES_001,0.18,228.5,49.86,OK
2025-01-01T23:15:00,SITE_RES_002,0.115,235.9,49.91,OK
30/01/2025 00:15:00,SITE_RES_002,0.117,229.4,49.83,OK
2025-01-30T16:30:00,SITE_COM_001,1.153,229.0,50.0,OK
2025-01-12T23:15:00,SITE_COM_001,-777.0,239.2,50.02,ERROR
2025-01-15T06:30:00,SITE_COM_002,0.127,221.8,50.11,OK
2025-01-07T02:45:00,SITE_IND_001,1.79,236.6,49.9,OK
2025-01-06 22:00:00,SITE_COM_002,0.125,215.1,50.03,OK
12/01/2025 07:00:00,SITE_IND_001,1.357,213.9,50.14,OK
26/01/2025 21:45:00,SITE_IND_001,1.626,241.5,50.14,OK
2025-01-22T01:30:00,SITE_COM_002,0.165,226.4,49.93,OK
2025-01-19T16:30:00,SITE_RES_002,0.127,237.7,50.21,OK
07/01/2025 16:30:00,SITE_RES_002,0.115,225.8,50.0,OK
2025-01-01T12:00:00,SITE_COM_001,1.168,222.0,49.72,OK
16/01/2025 07:15:00,SITE_RES_002,0.337,249.3,50.03,OK
2025-01-29 22:15:00,SITE_COM_002,0.151,229.8,50.1,OK
2025-01-28T07:00:00,SITE_IND_002,,221.9,50.05,ERROR
2025-01-14T01:30:00,SITE_RES_001,0.15,240.6,49.91,OK
23/01/2025 23:15:00,SITE_COM_002,0.157,238.3,50.28,OK
2025-01-11T08:00:00,SITE_COM_001,1.065,225.8,49.76,OK
2025-01-08T03:45:00,SITE_COM_002,0.151,231.7,49.63,OK
2025-01-23 20:15:00,SITE_IND_002,2.393,235.0,49.92,OK
2025-01-22 19:00:00,SITE_RES_001,,241.4,49.89,ERROR
16/01/2025 00:45:00,SITE_RES_002,0.118,224.3,49.86,OK
2025-01-13 07:15:00,SITE_RES_002,0.281,227.8,50.01,OK
2025-01-09T20:15:00,SITE_RES_001,0.271,231.0,49.87,OK
2025-01-20 10:00:00,SITE_RES_001,0.18,218.4,50.21,OK
2025-01-19T22:00:00,SITE_COM_002,-888.0,235.2,49.8,ERROR
2025-01-26 14:15:00,SITE_IND_002,1.054,234.2,50.1,OK
2025-01-14T09:00:00,SITE_IND_001,3.59,223.9,50.01,OK
2025-01-04T16:30:00,SITE_RES_002,0.094,238.4,50.15,OK
2025-01-05T13:00:00,SITE_IND_001,1.354,226.7,50.4,OK
13/01/2025 14:45:00,SITE_COM_001,1.059,218.6,50.16,OK
24/01/2025 04:15:00,SITE_RES_001,0.132,210.3,49.96,OK
2025-01-08T12:30:00,SITE_IND_002,1.998,230.1,50.11,OK
2025-01-17 06:15:00,SITE_IND_001,3.44,219.2,49.99,OK
2025-01-09T01:00:00,SITE_COM_001,0.199,222.0,49.7,OK
09/01/2025 15:30:00,SITE_COM_002,0.879,248.7,50.0,OK
04/01/2025 12:45:00,SITE_RES_002,0.105,235.5,49.93,OK
2025-01-21T19:00:00,SITE_RES_001,0.317,241.7,50.18,OK
2025-01-19T20:30:00,SITE_RES_002,0.335,236.4,49.82,OK
2025-01-14T10:30:00,SITE_RES_001,0.143,241.3,50.37,OK
30/01/2025 04:00:00,SITE_RES_002,0.127,236.0,50.11,OK
2025-01-23 02:00:00,SITE_RES_001,0.164,224.7,50.0,OK
05/01/2025 17:45:00,SITE_IND_001,1.636,225.9,49.99,OK
2025-01-03T12:30:00,SITE_IND_002,2.7,233.1,49.84,OK
28/01/2025 19:15:00,SITE_COM_001,-888.0,241.4,50.15,ERROR
2025-01-17 04:45:00,SITE_RES_001,0.176,221.0,50.35,OK
2025-01-07T21:15:00,SITE_RES_002,0.107,219.0,50.05,OK
10/01/2025 10:45:00,SITE_RES_001,0.155,220.9,49.97,OK
25/01/2025 04:45:00,SITE_IND_002,1.3,234.9,49.84,OK
2025-01-09 05:00:00,SITE_COM_001,0.243,231.9,49.94,OK
03/01/2025 20:15:00,SITE_COM_001,0.25,233.1,50.12,OK
12/01/2025 06:15:00,SITE_RES_001,0.135,228.6,49.67,OK
2025-01-22T11:30:00,SITE_RES_001,0.179,220.2,50.14,OK
27/01/2025 05:45:00,SITE_RES_001,0.2,235.2,50.12,OK
23/01/2025 12:15:00,SITE_RES_002,0.117,224.7,50.11,OK
2025-01-19T20:30:00,SITE_COM_001,0.182,234.6,50.04,OK
2025-01-17 08:30:00,SITE_COM_002,0.947,227.7,50.02,OK
06/01/2025 05:30:00,SITE_RES_001,0.155,239.0,50.08,OK
23/01/2025 18:00:00,SITE_IND_002,2.224,214.0,50.19,OK
2025-01-14T22:45:00,SITE_COM_002,0.145,232.1,50.0,OK
2025-01-17T06:30:00,SITE_RES_001,0.125,220.4,49.89,OK
14/01/2025 11:45:00,SITE_IND_001,3.353,237.9,49.81,OK
2025-01-16T14:00:00,SITE_IND_002,2.591,225.6,50.24,OK
2025-01-17T14:30:00,SITE_COM_002,1.053,232.7,49.76,OK
2025-01-27T02:15:00,SITE_COM_002,0.137,220.3,49.98,OK
2025-01-26T17:00:00,SITE_RES_001,0.151,232.0,50.13,OK
2025-01-08T12:45:00,SITE_IND_001,3.155,216.9,49.65,OK
2025-01-14T04:15:00,SITE_COM_001,5.952,232.6,50.14,OK
13/01/2025 12:45:00,SITE_COM_002,0.921,214.9,49.75,OK
17/01/2025 09:15:00,SITE_RES_002,0.105,236.6,49.86,OK
25/01/2025 11:45:00,SITE_COM_001,0.886,235.0,50.09,OK
2025-01-28T14:30:00,SITE_RES_002,0.111,237.1,49.72,OK
22/01/2025 16:30:00,SITE_COM_002,0.879,225.9,49.94,OK
2025-01-15T12:45:00,SITE_IND_001,4.0,229.2,50.15,OK
2025-01-20T20:15:00,SITE_COM_002,0.148,230.3,50.08,OK
2025-01-30T06:15:00,SITE_IND_001,3.668,231.2,49.92,OK
2025-01-24T21:15:00,SITE_IND_002,2.05,218.6,49.67,OK
2025-01-07T05:45:00,SITE_IND_002,1.194,240.6,49.98,OK
20/01/2025 22:45:00,SITE_IND_002,1.042,211.1,50.09,OK
2025-01-26T10:00:00,SITE_RES_002,0.113,237.4,50.23,OK
2025-01-24T08:15:00,SITE_IND_002,2.642,224.9,49.95,OK
2025-01-25T03:30:00,SITE_IND_001,1.214,227.6,49.78,OK
23/01/2025 01:30:00,SITE_IND_001,1.839,236.5,49.79,OK
2025-01-19T05:15:00,SITE_COM_002,0.134,229.5,50.26,OK
2025-01-02T01:45:00,SITE_COM_002,0.111,243.0,49.67,OK
2025-01-09T14:45:00,SITE_COM_002,0.979,237.2,49.87,OK
2025-01-11 06:45:00,SITE_COM_001,0.152,230.3,49.76,OK
2025-01-03T22:15:00,SITE_COM_001,0.222,228.0,50.01,OK
04/01/2025 22:30:00,SITE_COM_001,0.213,215.7,49.83,OK
2025-01-29 18:15:00,SITE_IND_001,3.998,235.8,49.6,OK
2025-01-05T11:30:00,SITE_COM_002,1.088,230.2,50.06,OK
2025-01-17 19:00:00,SITE_IND_001,3.881,226.4,49.85,OK
14/01/2025 17:45:00,SITE_IND_001,-888.0,245.4,49.79,ERROR
2025-01-05T17:00:00,SITE_IND_001,,236.0,49.68,ERROR
23/01/2025 03:15:00,SITE_COM_002,0.14,241.2,49.99,OK
02/01/2025 06:30:00,SITE_RES_001,0.152,230.0,49.75,OK
2025-01-29 06:00:00,SITE_RES_001,0.161,229.3,49.8,OK
2025-01-24 11:00:00,SITE_COM_002,0.928,224.2,49.96,OK
2025-01-21T10:30:00,SITE_IND_002,2.695,208.2,50.09,OK
2025-01-14T07:30:00,SITE_IND_001,3.942,204.8,50.0,OK
2025-01-20 12:15:00,SITE_IND_001,3.171,221.6,50.2,OK
2025-01-28T18:15:00,SITE_RES_001,0.448,222.2,49.89,OK
19/01/2025 05:15:00,SITE_RES_001,0.147,234.3,49.98,OK
2025-01-07T05:00:00,SITE_COM_002,-777.0,225.9,49.71,ERROR
2025-01-30T09:45:00,SITE_COM_001,1.335,226.1,50.27,OK
2025-01-14T13:00:00,SITE_COM_001,1.292,230.2,49.96,OK
27/01/2025 15:00:00,SITE_COM_002,0.738,229.9,49.81,OK
2025-01-13T16:15:00,SITE_IND_001,4.097,243.4,50.09,OK
2025-01-28 11:00:00,SITE_RES_002,0.124,246.6,50.15,OK
15/01/2025 23:30:00,SITE_COM_001,0.224,244.4,49.62,OK
05/01/2025 00:30:00,SITE_COM_002,0.191,256.7,50.02,OK
29/01/2025 00:30:00,SITE_IND_001,1.477,225.3,49.97,OK
2025-01-02 10:30:00,SITE_IND_001,3.211,238.6,49.92,OK
2025-01-16T07:00:00,SITE_COM_001,0.25,213.5,50.15,OK
2025-01-18T04:00:00,SITE_COM_002,0.167,251.6,50.08,OK
2025-01-17T14:15:00,SITE_RES_002,,206.5,50.05,ERROR
2025-01-16T12:15:00,SITE_IND_002,2.369,241.1,49.95,OK
2025-01-18T16:15:00,SITE_COM_001,1.359,243.4,49.93,OK
2025-01-12T09:00:00,SITE_RES_002,0.103,231.0,49.86,OK
13/01/2025 17:15:00,SITE_IND_002,2.461,224.9,50.25,OK
2025-01-16 22:45:00,SITE_COM_002,0.167,201.8,49.99,OK
2025-01-26T16:30:00,SITE_COM_002,0.827,237.8,50.4,OK
11/01/2025 23:15:00,SITE_COM_002,4.319,237.5,50.15,OK
2025-01-27T20:15:00,SITE_RES_001,0.423,228.4,49.94,OK
2025-01-20T06:45:00,SITE_COM_002,,222.4,49.98,ERROR
2025-01-29T21:15:00,SITE_RES_001,0.181,247.5,50.09,OK
23/01/2025 04:45:00,SITE_IND_001,1.458,221.9,50.03,OK
2025-01-28T14:45:00,SITE_IND_002,2.793,231.4,50.2,OK
2025-01-08T07:00:00,SITE_RES_002,0.322,246.8,50.11,OK
09/01/2025 17:00:00,SITE_COM_001,1.164,217.6,49.92,OK
2025-01-23 10:30:00,SITE_COM_002,0.758,226.5,49.78,OK
2025-01-13 01:45:00,SITE_IND_002,0.795,233.4,50.18,OK
2025-01-10T07:15:00,SITE_IND_002,2.295,229.3,49.9,OK
2025-01-02 14:30:00,SITE_RES_001,0.148,226.5,49.85,OK
14/01/2025 07:00:00,SITE_RES_001,0.376,226.6,49.83,OK
2025-01-23 13:15:00,SITE_COM_001,-777.0,227.2,50.24,ERROR
2025-01-24T02:15:00,SITE_IND_002,0.805,226.2,49.82,OK
07/01/2025 04:15:00,SITE_RES_001,,227.4,50.24,ERROR
07/01/2025 23:45:00,SITE_COM_001,0.176,245.6,50.16,OK
25/01/2025 21:15:00,SITE_RES_002,0.083,217.2,50.07,OK
2025-01-04T23:45:00,SITE_COM_002,0.14,226.3,50.06,OK
2025-01-02T05:15:00,SITE_COM_002,0.138,227.7,49.8,OK
2025-01-23 15:30:00,SITE_RES_001,0.184,243.1,49.96,OK
22/01/2025 08:15:00,SITE_IND_001,2.905,235.6,49.93,OK
2025-01-30T01:30:00,SITE_IND_002,1.122,230.1,50.05,OK
2025-01-01T08:15:00,SITE_COM_001,1.336,220.8,50.17,OK
2025-01-23 17:45:00,SITE_IND_001,3.887,221.9,50.23,OK
2025-01-17T16:15:00,SITE_RES_002,-888.0,224.2,49.76,ERROR
2025-01-17T12:30:00,SITE_RES_001,0.166,218.1,49.5,OK
2025-01-10T01:30:00,SITE_RES_002,0.11,226.5,49.81,OK
2025-01-28T13:00:00,SITE_COM_002,0.838,251.7,49.74,OK
05/01/2025 15:45:00,SITE_COM_001,1.124,225.1,49.89,OK
2025-01-17 21:15:00,SITE_COM_001,0.212,227.1,50.48,OK
2025-01-22 22:15:00,SITE_COM_002,0.137,217.8,49.88,OK
22/01/2025 18:30:00,SITE_COM_001,0.978,224.0,49.89,OK
21/01/2025 21:00:00,SITE_COM_001,0.21,232.3,49.96,OK
2025-01-05T11:30:00,SITE_RES_002,0.122,220.4,50.46,OK
08/01/2025 12:15:00,SITE_COM_001,1.347,211.0,49.83,OK
2025-01-20T00:00:00,SITE_IND_002,1.192,232.5,49.79,OK
2025-01-12 22:30:00,SITE_COM_002,0.188,220.8,50.19,OK
09/01/2025 12:45:00,SITE_IND_001,3.754,236.3,50.09,OK
29/01/2025 20:45:00,SITE_IND_002,1.851,217.7,49.63,OK
24/01/2025 11:30:00,SITE_RES_002,0.133,223.9,50.05,OK
2025-01-06T10:00:00,SITE_RES_002,0.102,209.4,50.24,OK
2025-01-17T20:00:00,SITE_IND_001,2.741,223.6,50.01,OK
13/01/2025 23:15:00,SITE_COM_002,,228.6,50.11,ERROR
2025-01-14T16:30:00,SITE_RES_002,0.106,236.7,49.73,OK
2025-01-06 05:30:00,SITE_IND_002,1.049,232.2,50.06,OK
22/01/2025 19:15:00,SITE_IND_001,3.518,221.9,49.95,OK
2025-01-04T17:45:00,SITE_COM_002,0.858,231.3,49.52,OK
14/01/2025 07:00:00,SITE_RES_001,0.376,226.6,49.83,OK
2025-01-25T17:30:00,SITE_RES_001,0.136,236.1,49.94,OK
2025-01-29T23:15:00,SITE_RES_002,0.098,217.6,49.68,OK
15/01/2025 08:15:00,SITE_RES_002,0.263,225.3,50.12,OK
2025-01-05T09:30:00,SITE_COM_001,1.287,221.5,50.06,OK
28/01/2025 10:15:00,SITE_COM_001,1.127,217.3,50.05,OK
27/01/2025 08:15:00,SITE_RES_002,0.324,222.4,49.71,OK
2025-01-16T11:30:00,SITE_IND_001,3.132,221.6,50.28,OK
2025-01-03T23:00:00,SITE_IND_002,1.132,246.7,49.88,OK
07/01/2025 01:45:00,SITE_RES_001,0.151,211.2,50.1,OK
06/01/2025 04:30:00,SITE_IND_001,1.65,214.5,49.93,OK
2025-01-08 00:30:00,SITE_RES_001,0.152,237.0,50.21,OK
2025-01-11T06:30:00,SITE_RES_002,0.147,239.1,49.86,OK
11/01/2025 01:45:00,SITE_IND_001,1.47,230.8,49.5,OK
2025-01-08 02:00:00,SITE_IND_002,1.195,245.6,50.59,OK
2025-01-18T20:15:00,SITE_COM_002,0.177,243.4,49.77,OK
17/01/2025 09:00:00,SITE_COM_001,1.372,235.5,50.11,OK
2025-01-16T19:45:00,SITE_RES_002,0.205,217.3,49.93,OK
2025-01-23T12:15:00,SITE_RES_001,0.19,213.5,49.82,OK
2025-01-14 06:30:00,SITE_COM_001,0.192,205.4,50.11,OK
07/01/2025 09:30:00,SITE_IND_001,3.703,230.0,50.17,OK
2025-01-04T19:00:00,SITE_IND_001,,222.5,49.94,ERROR
2025-01-03 07:15:00,SITE_COM_001,0.207,209.2,50.11,OK
2025-01-17T03:45:00,SITE_COM_001,0.228,225.0,49.96,OK
2025-01-16 00:15:00,SITE_IND_002,1.039,222.6,49.85,OK
2025-01-09T16:45:00,SITE_RES_002,0.12,225.0,50.04,OK
2025-01-14T23:30:00,SITE_RES_001,0.175,224.5,49.7,OK
2025-01-17 11:45:00,SITE_COM_001,1.115,227.3,50.07,OK
23/01/2025 07:45:00,SITE_RES_002,0.357,240.7,50.0,OK
22/01/2025 05:30:00,SITE_COM_001,0.207,218.7,49.77,OK
2025-01-01T02:15:00,SITE_RES_002,0.146,227.4,50.54,OK
27/01/2025 02:30:00,SITE_RES_002,0.116,221.9,50.22,OK
2025-01-05T04:45:00,SITE_COM_001,0.26,230.1,50.08,OK
2025-01-17T15:00:00,SITE_IND_002,1.972,228.3,50.03,OK
2025-01-29T23:30:00,SITE_RES_002,0.128,225.9,49.81,OK
2025-01-01T13:15:00,SITE_RES_001,0.144,248.0,49.99,OK
2025-01-11T04:00:00,SITE_COM_001,0.228,222.2,49.9,OK
2025-01-09T05:45:00,SITE_RES_001,0.216,231.4,49.79,OK
16/01/2025 03:30:00,SITE_RES_002,0.089,226.8,49.94,OK
2025-01-11T14:30:00,SITE_RES_002,0.114,230.9,49.96,OK
2025-01-20T04:30:00,SITE_COM_001,0.181,229.6,50.0,OK
18/01/2025 18:45:00,SITE_IND_001,1.533,221.9,49.68,OK
2025-01-30T20:45:00,SITE_COM_001,0.244,248.5,49.93,OK
2025-01-13 05:45:00,SITE_IND_001,1.384,243.4,49.95,OK
16/01/2025 07:45:00,SITE_RES_001,0.389,223.7,50.53,OK
2025-01-14 18:30:00,SITE_RES_001,0.267,229.4,49.65,OK
2025-01-19 11:45:00,SITE_RES_001,0.108,249.4,50.19,OK
2025-01-07 10:15:00,SITE_IND_002,1.958,221.5,50.19,OK
2025-01-07T02:15:00,SITE_IND_002,1.178,213.8,49.76,OK
2025-01-19T17:15:00,SITE_COM_001,0.865,241.8,49.92,OK
2025-01-04 09:00:00,SITE_IND_001,1.252,238.2,50.04,OK
2025-01-29 02:45:00,SITE_COM_001,0.216,223.0,50.42,OK
21/01/2025 00:30:00,SITE_COM_002,0.118,227.6,50.05,OK
2025-01-30T02:00:00,SITE_IND_002,1.169,227.8,49.73,OK
2025-01-02 16:45:00,SITE_COM_001,1.379,225.3,50.13,OK
17/01/2025 05:00:00,SITE_RES_002,0.134,232.5,49.97,OK
2025-01-24 11:45:00,SITE_COM_002,0.886,251.7,50.04,OK
2025-01-06T13:45:00,SITE_COM_002,0.868,213.0,50.07,OK
2025-01-22T16:30:00,SITE_IND_002,2.726,230.5,50.2,OK
2025-01-17 06:00:00,SITE_RES_001,0.173,228.3,50.16,OK
2025-01-01T19:00:00,SITE_RES_001,0.441,225.1,50.43,OK
2025-01-16T09:00:00,SITE_RES_001,0.187,240.2,50.21,OK
2025-01-16 13:00:00,SITE_IND_001,4.068,224.2,49.89,OK
29/01/2025 17:30:00,SITE_COM_001,1.293,233.1,49.98,OK
2025-01-22T06:30:00,SITE_COM_002,0.141,212.6,50.06,OK
2025-01-05T11:15:00,SITE_RES_001,0.163,213.3,50.54,OK
2025-01-07 22:15:00,SITE_IND_002,0.922,223.4,49.72,OK
2025-01-11T15:30:00,SITE_COM_001,0.97,229.7,50.14,OK
2025-01-27T12:15:00,SITE_RES_002,0.086,239.3,49.49,OK
2025-01-18 07:45:00,SITE_COM_002,0.165,234.9,49.87,OK
2025-01-05 09:45:00,SITE_RES_002,0.127,240.7,49.83,OK
2025-01-18T11:15:00,SITE_IND_001,1.679,228.4,49.69,OK
2025-01-01T04:15:00,SITE_IND_002,1.018,227.8,50.22,OK
2025-01-09 03:00:00,SITE_IND_001,1.306,224.1,50.26,OK
2025-01-13 18:30:00,SITE_RES_001,0.385,236.2,50.18,OK
2025-01-17T02:45:00,SITE_IND_001,1.805,236.4,49.76,OK
2025-01-12T17:30:00,SITE_IND_002,7.78,238.3,49.95,OK
16/01/2025 21:00:00,SITE_IND_001,2.971,250.4,50.12,OK
2025-01-01 04:00:00,SITE_RES_002,0.131,229.8,50.02,OK
2025-01-19T03:30:00,SITE_IND_001,1.402,223.6,50.09,OK
2025-01-25 23:15:00,SITE_IND_002,1.077,233.7,50.12,OK
2025-01-18 00:15:00,SITE_COM_001,0.237,228.5,49.92,OK
2025-01-28 10:45:00,SITE_IND_001,2.859,223.9,50.12,OK
2025-01-27T15:00:00,SITE_RES_001,0.141,229.3,50.0,OK
2025-01-12T22:45:00,SITE_COM_002,0.114,226.6,50.32,OK
27/01/2025 22:00:00,SITE_IND_002,1.088,220.6,49.92,OK
15/01/2025 18:45:00,SITE_IND_002,2.881,245.8,50.01,OK
16/01/2025 13:45:00,SITE_COM_001,1.178,236.2,50.2,OK
2025-01-22T13:00:00,SITE_COM_001,0.949,219.2,50.09,OK
2025-01-20 20:15:00,SITE_RES_001,0.335,243.2,49.79,OK
01/01/2025 13:00:00,SITE_IND_002,2.243,217.2,50.17,OK
2025-01-11T18:45:00,SITE_IND_002,1.018,218.0,49.9,OK
2025-01-06T06:00:00,SITE_IND_001,2.661,244.9,50.41,OK
2025-01-29T21:15:00,SITE_IND_001,3.21,239.1,49.93,OK
2025-01-05 04:00:00,SITE_COM_002,0.176,253.7,49.92,OK
2025-01-28T01:15:00,SITE_COM_001,0.24,220.4,49.96,OK
21/01/2025 04:30:00,SITE_COM_001,0.229,217.4,50.15,OK
2025-01-26 02:00:00,SITE_COM_001,0.218,230.2,50.36,OK
2025-01-24T22:45:00,SITE_IND_002,0.898,224.2,49.88,OK
26/01/2025 07:15:00,SITE_IND_001,,246.8,49.81,ERROR
2025-01-17T11:45:00,SITE_RES_001,0.151,211.4,50.3,OK
21/01/2025 07:30:00,SITE_COM_002,0.131,237.0,49.91,OK
28/01/2025 06:30:00,SITE_RES_001,0.163,212.5,49.57,OK
30/01/2025 21:45:00,SITE_RES_002,0.105,222.2,50.1,OK
28/01/2025 12:30:00,SITE_COM_002,0.852,244.8,50.27,OK
2025-01-06T09:30:00,SITE_COM_002,1.018,235.1,49.96,OK
2025-01-12T21:15:00,SITE_IND_002,1.073,233.5,50.09,OK
06/01/2025 09:15:00,SITE_COM_002,0.693,227.2,49.8,OK
13/01/2025 11:45:00,SITE_COM_002,0.631,221.4,50.02,OK
2025-01-14T22:45:00,SITE_IND_002,1.143,226.4,50.16,OK
2025-01-28T23:30:00,SITE_RES_002,,219.3,49.92,ERROR
18/01/2025 05:30:00,SITE_IND_002,1.146,215.3,49.98,OK
08/01/2025 15:45:00,SITE_COM_002,0.935,212.7,49.84,OK
04/01/2025 18:30:00,SITE_RES_002,,245.4,50.25,ERROR
03/01/2025 00:30:00,SITE_COM_001,0.195,226.4,50.24,OK
2025-01-10T15:45:00,SITE_IND_001,3.228,235.2,50.07,OK
10/01/2025 09:30:00,SITE_COM_001,1.175,204.3,49.91,OK
2025-01-04 16:30:00,SITE_COM_002,,224.8,49.97,ERROR
2025-01-20 01:30:00,SITE_IND_002,0.947,227.7,50.12,OK
2025-01-16T11:30:00,SITE_COM_001,1.517,214.4,49.94,OK
04/01/2025 07:30:00,SITE_COM_002,0.146,224.3,49.94,OK
07/01/2025 20:15:00,SITE_RES_001,0.513,231.0,50.12,OK
18/01/2025 08:00:00,SITE_COM_001,1.053,232.7,50.21,OK
2025-01-19 04:00:00,SITE_COM_001,0.227,245.8,49.88,OK
2025-01-02T02:15:00,SITE_RES_002,1.247,214.3,49.77,OK
20/01/2025 22:45:00,SITE_COM_001,0.188,227.4,50.17,OK
2025-01-21 10:30:00,SITE_IND_001,4.063,242.3,49.62,OK
2025-01-07T10:30:00,SITE_COM_001,0.916,233.9,50.07,OK
2025-01-07T10:15:00,SITE_RES_001,0.186,239.7,50.08,OK
2025-01-16T19:15:00,SITE_IND_001,4.006,218.3,50.02,OK
2025-01-08 03:30:00,SITE_COM_002,0.151,224.4,50.03,OK
2025-01-12T13:00:00,SITE_COM_001,0.969,233.1,49.93,OK
2025-01-10T08:15:00,SITE_RES_001,0.409,223.1,49.93,OK
04/01/2025 17:00:00,SITE_RES_002,0.122,224.5,50.1,OK
2025-01-30T17:15:00,SITE_RES_001,0.165,248.5,49.7,OK
2025-01-11T20:00:00,SITE_RES_002,0.268,233.5,49.51,OK
2025-01-27 05:30:00,SITE_COM_001,0.154,219.3,50.11,OK
2025-01-21T04:45:00,SITE_IND_002,1.089,234.4,50.25,OK
17/01/2025 17:45:00,SITE_RES_001,0.183,229.4,50.03,OK
2025-01-18T00:45:00,SITE_IND_001,1.124,247.9,49.77,OK
2025-01-15T10:45:00,SITE_COM_001,1.507,218.6,49.93,OK
2025-01-06T23:00:00,SITE_IND_002,1.12,249.1,49.8,OK
25/01/2025 02:15:00,SITE_IND_002,0.849,237.6,50.12,OK
2025-01-05T23:45:00,SITE_IND_001,1.436,241.9,50.2,OK
01/01/2025 19:45:00,SITE_COM_001,1.16,227.2,50.06,OK
2025-01-26T00:30:00,SITE_RES_001,0.138,241.0,50.41,OK
2025-01-02 23:45:00,SITE_IND_002,0.953,231.4,50.32,OK
13/01/2025 15:00:00,SITE_IND_001,3.277,234.1,49.98,OK
2025-01-27 13:00:00,SITE_COM_002,0.745,213.3,49.81,OK
2025-01-07T06:30:00,SITE_RES_002,0.132,228.0,49.92,OK
23/01/2025 16:30:00,SITE_COM_002,1.014,236.7,50.25,OK
2025-01-11T04:00:00,SITE_IND_002,0.967,228.1,49.78,OK
25/01/2025 14:15:00,SITE_RES_001,0.188,221.8,50.17,OK
2025-01-02T03:00:00,SITE_COM_002,0.135,224.0,50.27,OK
2025-01-01 05:00:00,SITE_COM_002,0.133,230.2,50.1,OK
2025-01-12T10:45:00,SITE_IND_002,1.406,242.3,49.71,OK
11/01/2025 15:45:00,SITE_RES_002,0.117,229.9,50.19,OK
2025-01-11 10:45:00,SITE_COM_001,1.225,223.7,49.88,OK
2025-01-11T02:15:00,SITE_IND_001,1.476,210.5,50.12,OK
2025-01-14 14:00:00,SITE_COM_002,0.994,242.0,50.22,OK
2025-01-19T17:45:00,SITE_IND_001,1.574,216.6,50.22,OK
2025-01-15T21:30:00,SITE_COM_002,0.137,232.7,49.97,OK
12/01/2025 06:30:00,SITE_IND_001,1.771,225.4,49.95,OK
2025-01-14T04:00:00,SITE_RES_002,0.116,221.1,49.77,OK
2025-01-28 08:30:00,SITE_COM_002,0.843,219.1,50.02,OK
2025-01-02T18:45:00,SITE_IND_002,2.502,210.3,49.78,OK
15/01/2025 16:30:00,SITE_IND_001,3.233,236.5,50.13,OK
2025-01-19T23:15:00,SITE_IND_001,1.298,221.3,49.51,OK
2025-01-20 04:30:00,SITE_RES_002,0.117,222.9,50.01,OK
2025-01-15T12:15:00,SITE_COM_001,1.101,234.9,49.77,OK
16/01/2025 10:15:00,SITE_IND_001,2.939,222.5,50.34,OK
24/01/2025 09:00:00,SITE_IND_002,2.474,221.0,50.09,OK
2025-01-10 06:45:00,SITE_IND_001,3.131,229.1,50.04,OK
2025-01-13T13:30:00,SITE_COM_001,1.103,230.3,49.95,OK
2025-01-15T21:00:00,SITE_COM_001,0.171,221.4,49.88,OK
17/01/2025 01:15:00,SITE_COM_001,0.153,219.1,49.99,OK
10/01/2025 03:00:00,SITE_COM_002,0.147,220.2,50.15,OK
05/01/2025 08:00:00,SITE_RES_002,0.304,223.3,49.55,OK
2025-01-15 11:45:00,SITE_COM_001,0.978,227.3,50.37,OK
20/01/2025 11:00:00,SITE_COM_002,1.029,229.2,50.2,OK
17/01/2025 14:45:00,SITE_COM_001,1.019,238.7,50.14,OK
2025-01-25T04:00:00,SITE_RES_002,0.138,244.5,50.15,OK
02/01/2025 05:30:00,SITE_IND_001,,235.5,49.76,ERROR
2025-01-10T20:00:00,SITE_COM_002,0.154,243.6,49.99,OK
2025-01-26T13:15:00,SITE_IND_002,0.84,228.6,49.74,OK
17/01/2025 07:45:00,SITE_RES_001,0.437,238.8,49.93,OK
2025-01-20T06:15:00,SITE_COM_001,0.177,241.0,49.73,OK
11/01/2025 07:45:00,SITE_COM_001,0.139,238.8,49.88,OK
2025-01-08T19:00:00,SITE_IND_001,3.637,243.2,50.11,OK
2025-01-13T15:30:00,SITE_IND_001,3.456,229.7,49.99,OK
26/01/2025 09:45:00,SITE_RES_001,0.158,221.5,50.12,OK
2025-01-12T19:45:00,SITE_RES_001,0.439,216.3,49.75,OK
05/01/2025 01:15:00,SITE_IND_001,1.661,227.7,50.14,OK
2025-01-13T10:15:00,SITE_IND_002,2.363,236.0,50.29,OK
2025-01-22 07:00:00,SITE_IND_001,2.733,228.8,50.16,OK
15/01/2025 09:15:00,SITE_IND_002,2.551,213.3,50.03,OK
2025-01-04T13:30:00,SITE_COM_001,0.975,214.7,50.32,OK
2025-01-06 13:00:00,SITE_COM_001,0.924,232.7,50.23,OK
2025-01-14T03:45:00,SITE_RES_001,0.181,216.3,50.1,OK
2025-01-14 17:30:00,SITE_RES_001,0.112,226.4,49.67,OK
2025-01-05T13:30:00,SITE_IND_002,0.789,235.8,49.95,OK
08/01/2025 09:15:00,SITE_IND_001,3.192,230.8,50.04,OK
12/01/2025 16:30:00,SITE_COM_001,1.169,244.5,50.13,OK
2025-01-05 02:15:00,SITE_COM_001,0.21,242.4,49.84,OK
2025-01-28T10:15:00,SITE_RES_002,0.124,225.3,50.2,OK
21/01/2025 07:45:00,SITE_RES_001,0.437,233.0,50.22,OK
2025-01-28T18:30:00,SITE_COM_001,1.213,222.7,49.74,OK
13/01/2025 09:15:00,SITE_RES_001,0.134,220.9,50.03,OK
15/01/2025 09:15:00,SITE_COM_002,0.901,232.3,49.94,OK
2025-01-07 00:45:00,SITE_COM_002,0.173,233.2,49.99,OK
2025-01-13T16:00:00,SITE_RES_002,0.11,227.8,49.98,OK
08/01/2025 12:45:00,SITE_RES_001,,229.6,49.88,ERROR
2025-01-07T11:00:00,SITE_RES_002,0.129,232.6,50.19,OK
2025-01-14 02:30:00,SITE_RES_002,0.096,231.0,49.54,OK
2025-01-08T14:45:00,SITE_RES_002,0.129,236.5,50.23,OK
2025-01-14T19:30:00,SITE_COM_001,0.91,250.1,50.12,OK
05/01/2025 21:00:00,SITE_RES_002,0.129,222.0,50.28,OK
2025-01-18T17:45:00,SITE_IND_002,1.02,249.7,49.97,OK
2025-01-21T15:15:00,SITE_RES_002,0.124,219.9,49.81,OK
2025-01-07 21:45:00,SITE_IND_001,3.303,232.6,50.16,OK
2025-01-08T10:15:00,SITE_IND_002,2.23,233.9,50.07,OK
2025-01-23T22:15:00,SITE_COM_002,0.154,210.2,50.31,OK
2025-01-19T10:00:00,SITE_IND_001,1.453,250.1,50.03,OK
2025-01-06 14:30:00,SITE_RES_002,0.093,227.5,50.09,OK
2025-01-29T17:45:00,SITE_IND_002,2.557,227.4,49.75,OK
2025-01-01T15:00:00,SITE_IND_002,3.213,233.8,50.09,OK
2025-01-06 18:00:00,SITE_COM_002,0.659,206.6,49.88,OK
2025-01-01T14:45:00,SITE_COM_002,0.964,230.8,49.74,OK
2025-01-29T13:15:00,SITE_RES_001,0.138,225.5,49.94,OK
2025-01-26 19:15:00,SITE_COM_001,3.013,225.5,50.3,OK
2025-01-22T00:30:00,SITE_RES_002,0.114,238.7,49.95,OK
2025-01-29T10:30:00,SITE_IND_002,2.747,231.0,50.27,OK
2025-01-14 03:00:00,SITE_COM_001,0.221,225.0,49.73,OK
2025-01-22T13:30:00,SITE_RES_002,0.124,223.9,50.06,OK
2025-01-07 03:00:00,SITE_RES_001,0.172,238.8,50.06,OK
2025-01-11T20:45:00,SITE_IND_002,1.203,227.8,49.79,OK
28/01/2025 11:15:00,SITE_COM_001,1.446,243.2,49.69,OK
2025-01-11 07:00:00,SITE_RES_002,0.268,241.7,50.01,OK
28/01/2025 19:45:00,SITE_IND_002,2.307,220.2,50.34,OK
2025-01-20 22:00:00,SITE_RES_001,,239.7,49.97,ERROR
2025-01-16T14:30:00,SITE_COM_002,0.951,228.9,49.59,OK
2025-01-26 22:00:00,SITE_COM_002,0.128,232.8,49.83,OK
2025-01-29T09:30:00,SITE_COM_001,0.882,238.1,50.24,OK
2025-01-03 17:30:00,SITE_IND_001,4.754,241.8,50.14,OK
24/01/2025 21:30:00,SITE_RES_001,0.159,218.8,49.81,OK
2025-01-05T18:30:00,SITE_COM_002,0.762,231.1,50.29,OK
2025-01-21 08:45:00,SITE_IND_002,2.851,238.2,49.63,OK
07/01/2025 10:00:00,SITE_COM_001,1.092,236.2,49.74,OK
2025-01-26 09:00:00,SITE_COM_001,1.259,215.9,49.89,OK
2025-01-04T10:30:00,SITE_RES_001,0.143,238.1,50.11,OK
2025-01-20T06:15:00,SITE_RES_001,0.136,229.8,50.24,OK
03/01/2025 00:15:00,SITE_RES_001,0.197,236.6,49.82,OK
2025-01-11 19:00:00,SITE_IND_001,1.536,229.8,50.59,OK
2025-01-28T09:45:00,SITE_RES_001,0.154,218.2,50.04,OK
2025-01-21 23:45:00,SITE_COM_001,0.215,211.6,49.92,OK
2025-01-04T20:15:00,SITE_IND_001,-777.0,223.3,49.8,ERROR
12/01/2025 02:45:00,SITE_IND_001,1.514,226.2,49.92,OK
06/01/2025 06:15:00,SITE_RES_002,0.114,237.6,50.09,OK
06/01/2025 14:30:00,SITE_COM_001,1.287,227.0,50.51,OK
2025-01-19T00:15:00,SITE_IND_002,1.295,241.2,49.91,OK
2025-01-25T08:00:00,SITE_RES_002,0.324,239.8,49.87,OK
2025-01-18T19:00:00,SITE_IND_002,0.524,221.8,49.7,OK
16/01/2025 21:15:00,SITE_COM_001,0.197,238.8,50.42,OK
27/01/2025 17:00:00,SITE_COM_002,0.843,233.9,50.35,OK
2025-01-01T13:30:00,SITE_COM_002,0.957,220.3,49.99,OK
2025-01-22T18:30:00,SITE_IND_001,3.641,238.9,49.86,OK
2025-01-29 09:45:00,SITE_IND_002,2.412,213.7,49.84,OK
2025-01-20 00:00:00,SITE_IND_001,1.63,222.0,49.95,OK
2025-01-20 20:30:00,SITE_IND_001,4.32,227.7,49.36,OK
2025-01-27 04:30:00,SITE_RES_002,0.089,223.0,49.91,OK
2025-01-13 13:00:00,SITE_RES_001,2.361,234.3,49.96,OK
2025-01-01 05:15:00,SITE_IND_002,0.956,208.8,49.89,OK
17/01/2025 16:45:00,SITE_IND_002,2.238,224.3,50.08,OK
2025-01-17T12:15:00,SITE_IND_002,2.649,236.7,49.93,OK
2025-01-21 20:45:00,SITE_IND_001,3.504,225.3,49.52,OK
2025-01-26T19:30:00,SITE_RES_002,0.302,234.5,50.1,OK
23/01/2025 09:00:00,SITE_IND_001,2.532,213.3,49.63,OK
2025-01-29 06:45:00,SITE_COM_001,0.23,223.1,50.04,OK
17/01/2025 00:45:00,SITE_RES_001,0.125,246.8,49.91,OK
18/01/2025 04:30:00,SITE_RES_001,0.151,215.7,50.14,OK
2025-01-01T18:45:00,SITE_IND_001,,212.0,50.11,ERROR
2025-01-02T21:15:00,SITE_IND_001,4.123,244.4,49.95,OK
08/01/2025 10:30:00,SITE_RES_001,0.155,232.9,50.07,OK
2025-01-08 08:45:00,SITE_RES_001,0.536,239.4,49.69,OK
2025-01-01 03:30:00,SITE_RES_001,0.154,217.5,50.33,OK
14/01/2025 14:30:00,SITE_RES_001,0.181,225.6,49.72,OK
2025-01-18T23:45:00,SITE_IND_001,1.572,214.9,49.71,OK
09/01/2025 15:30:00,SITE_COM_001,1.215,226.7,50.15,OK
2025-01-03T16:45:00,SITE_COM_002,0.68,234.8,49.79,OK
2025-01-18T04:15:00,SITE_IND_002,1.1,237.8,49.93,OK
2025-01-05T06:15:00,SITE_RES_001,0.171,249.7,50.09,OK
2025-01-26T12:00:00,SITE_COM_001,1.116,225.8,50.29,OK
2025-01-26T19:30:00,SITE_RES_001,0.39,241.4,50.11,OK
2025-01-18 00:00:00,SITE_RES_001,0.187,247.3,50.02,OK
2025-01-15 22:45:00,SITE_COM_001,0.12,259.6,50.04,OK
08/01/2025 21:15:00,SITE_RES_002,0.113,214.9,49.74,OK
2025-01-29 22:30:00,SITE_COM_002,-999.0,221.6,50.07,ERROR
27/01/2025 00:45:00,SITE_COM_002,0.15,230.0,50.16,OK
2025-01-28T16:30:00,SITE_COM_001,1.516,226.3,50.08,OK
2025-01-06T20:45:00,SITE_IND_002,1.776,240.2,49.74,OK
2025-01-24T18:30:00,SITE_IND_001,2.534,252.0,50.3,OK
17/01/2025 17:00:00,SITE_COM_001,1.234,233.4,49.67,OK
2025-01-09T23:15:00,SITE_COM_001,0.168,229.3,50.06,OK
2025-01-08T17:15:00,SITE_RES_001,0.137,234.7,50.18,OK
2025-01-12T11:00:00,SITE_IND_002,1.042,238.7,49.94,OK
2025-01-18T11:30:00,SITE_IND_002,1.213,219.8,49.91,OK
2025-01-10T19:00:00,SITE_COM_001,1.061,226.1,49.9,OK
2025-01-24 01:15:00,SITE_IND_001,1.725,233.4,50.18,OK
2025-01-02 06:30:00,SITE_IND_002,2.629,248.0,49.96,OK
2025-01-24T16:45:00,SITE_COM_002,1.035,232.7,50.2,OK
2025-01-15T09:00:00,SITE_RES_002,0.119,235.1,50.03,OK
2025-01-05T06:00:00,SITE_COM_001,0.173,231.3,49.9,OK
06/01/2025 19:00:00,SITE_RES_002,0.303,237.7,50.3,OK
2025-01-29T09:30:00,SITE_IND_002,2.345,226.4,49.98,OK
2025-01-15 07:45:00,SITE_COM_002,0.126,221.5,50.15,OK
2025-01-07T09:30:00,SITE_COM_001,1.097,238.2,49.76,OK
2025-01-29 05:15:00,SITE_COM_002,0.146,231.8,49.69,OK
21/01/2025 02:00:00,SITE_IND_001,1.345,226.6,50.0,OK
10/01/2025 23:00:00,SITE_IND_001,1.292,229.3,49.83,OK
05/01/2025 21:00:00,SITE_RES_001,0.164,231.9,50.0,OK
2025-01-10T15:45:00,SITE_RES_001,0.186,239.6,50.32,OK
2025-01-19T09:30:00,SITE_COM_001,0.86,234.1,50.12,OK
2025-01-15T17:30:00,SITE_IND_002,2.548,224.0,49.88,OK
2025-01-22T11:30:00,SITE_RES_001,0.179,220.2,50.14,OK
2025-01-16T06:30:00,SITE_IND_002,2.451,240.0,49.47,OK
2025-01-22T00:45:00,SITE_COM_001,0.181,218.8,50.21,OK
2025-01-04T14:45:00,SITE_RES_002,0.134,228.4,50.06,OK
2025-01-13T01:45:00,SITE_IND_001,1.312,222.7,49.85,OK
2025-01-22T08:00:00,SITE_RES_001,,249.7,50.0,ERROR
23/01/2025 01:15:00,SITE_RES_001,0.199,237.7,50.28,OK
2025-01-25T12:15:00,SITE_COM_002,0.856,229.4,50.1,OK
2025-01-23 18:45:00,SITE_RES_001,0.493,228.3,50.06,OK
15/01/2025 02:45:00,SITE_IND_002,0.915,234.3,49.82,OK
13/01/2025 16:00:00,SITE_COM_001,0.911,220.9,49.81,OK
2025-01-08T03:00:00,SITE_IND_001,1.311,216.9,49.92,OK
06/01/2025 04:45:00,SITE_IND_002,1.312,223.2,49.88,OK
2025-01-09T19:45:00,SITE_IND_001,,216.8,49.97,ERROR
2025-01-17T10:00:00,SITE_COM_002,0.9,230.6,49.96,OK
2025-01-06T21:15:00,SITE_RES_001,0.178,236.2,49.87,OK
2025-01-20 05:15:00,SITE_COM_002,0.151,228.9,49.95,OK
06/01/2025 16:45:00,SITE_IND_001,3.641,232.5,49.83,OK
2025-01-07 08:00:00,SITE_COM_002,0.943,223.3,49.97,OK
26/01/2025 13:30:00,SITE_RES_001,0.16,236.8,49.74,OK
2025-01-19T01:45:00,SITE_RES_001,0.16,235.9,50.35,OK
2025-01-04T16:00:00,SITE_RES_002,0.101,216.5,50.15,OK
06/01/2025 10:45:00,SITE_RES_002,0.156,238.6,49.83,OK
03/01/2025 10:00:00,SITE_RES_002,0.125,242.8,49.51,OK
23/01/2025 02:30:00,SITE_COM_002,0.139,231.9,50.08,OK
2025-01-14T08:15:00,SITE_RES_002,0.311,205.4,50.08,OK
09/01/2025 21:30:00,SITE_IND_002,2.582,241.6,50.23,OK
2025-01-25T17:00:00,SITE_COM_002,1.127,229.7,49.73,OK
21/01/2025 01:45:00,SITE_RES_001,0.139,237.6,49.68,OK
21/01/2025 18:15:00,SITE_IND_001,3.692,210.7,50.17,OK
2025-01-10T15:00:00,SITE_RES_001,0.199,238.9,50.27,OK
11/01/2025 08:45:00,SITE_IND_001,-777.0,221.5,49.95,ERROR
2025-01-23T04:45:00,SITE_RES_002,0.145,238.0,50.04,OK
2025-01-14T17:30:00,SITE_IND_001,4.197,233.5,49.86,OK
12/01/2025 03:45:00,SITE_IND_002,1.216,239.1,49.94,OK
14/01/2025 17:30:00,SITE_COM_002,0.908,240.6,49.92,OK
2025-01-13T04:15:00,SITE_IND_002,1.157,229.5,49.94,OK
2025-01-22T19:00:00,SITE_IND_001,3.397,235.7,49.78,OK
08/01/2025 11:00:00,SITE_IND_001,3.563,223.6,50.2,OK
01/01/2025 07:00:00,SITE_IND_002,2.132,230.5,49.83,OK
2025-01-25 15:15:00,SITE_RES_002,0.085,243.0,50.21,OK
13/01/2025 14:00:00,SITE_RES_001,0.157,234.3,50.34,OK
2025-01-20 17:00:00,SITE_RES_001,0.17,211.7,50.46,OK
14/01/2025 11:45:00,SITE_RES_002,-999.0,215.7,49.73,ERROR
2025-01-08 14:45:00,SITE_COM_001,1.037,221.8,50.13,OK
11/01/2025 03:30:00,SITE_COM_002,0.135,247.5,49.98,OK
2025-01-23T04:15:00,SITE_RES_001,0.105,250.0,50.04,OK
2025-01-16 21:30:00,SITE_IND_001,3.351,223.6,50.02,OK
2025-01-12T18:45:00,SITE_IND_002,0.9,250.0,49.93,OK
2025-01-29T12:00:00,SITE_RES_001,0.157,236.2,49.79,OK
2025-01-15T18:00:00,SITE_RES_001,0.408,247.4,50.12,OK
2025-01-21 00:30:00,SITE_IND_001,1.354,220.8,50.04,OK
2025-01-05T16:15:00,SITE_COM_002,1.014,229.0,49.9,OK
12/01/2025 08:30:00,SITE_RES_001,,232.8,49.95,ERROR
2025-01-14T11:00:00,SITE_RES_002,0.096,220.5,49.75,OK
02/01/2025 18:45:00,SITE_IND_001,,227.5,50.24,ERROR
2025-01-21 16:45:00,SITE_COM_002,0.909,223.2,49.78,OK
2025-01-11 03:00:00,SITE_IND_002,1.119,242.4,50.06,OK
2025-01-25T15:30:00,SITE_RES_002,0.105,244.7,50.14,OK
03/01/2025 10:15:00,SITE_IND_001,2.247,225.0,50.22,OK
2025-01-18T02:45:00,SITE_IND_002,1.171,241.9,50.16,OK
2025-01-06 16:00:00,SITE_RES_001,0.18,216.9,50.03,OK
16/01/2025 23:00:00,SITE_COM_001,0.155,238.6,50.04,OK
12/01/2025 22:00:00,SITE_COM_001,0.193,231.1,49.7,OK
03/01/2025 15:30:00,SITE_COM_002,0.767,229.9,50.16,OK
2025-01-15 01:15:00,SITE_IND_001,1.614,220.4,49.71,OK
2025-01-09 22:15:00,SITE_IND_001,1.595,229.8,49.97,OK
17/01/2025 03:30:00,SITE_RES_002,0.117,239.8,50.13,OK
09/01/2025 17:15:00,SITE_RES_001,0.117,226.6,49.96,OK
25/01/2025 23:00:00,SITE_IND_002,1.105,227.9,49.27,OK
30/01/2025 13:45:00,SITE_IND_001,2.972,237.6,49.88,OK
24/01/2025 21:00:00,SITE_COM_002,0.151,230.4,49.88,OK
2025-01-17 22:30:00,SITE_RES_001,0.141,209.7,50.34,OK
2025-01-24T08:15:00,SITE_IND_002,2.642,224.9,49.95,OK
07/01/2025 00:45:00,SITE_RES_002,1.068,246.2,49.87,OK
2025-01-12 21:45:00,SITE_RES_002,0.129,218.9,49.68,OK
2025-01-02T09:00:00,SITE_COM_002,0.798,227.7,49.82,OK
02/01/2025 06:30:00,SITE_RES_001,0.152,230.0,49.75,OK
2025-01-17 15:45:00,SITE_IND_001,4.137,236.1,50.05,OK
2025-01-25 15:15:00,SITE_IND_001,1.278,221.0,49.73,OK
24/01/2025 23:30:00,SITE_RES_001,0.163,226.8,49.85,OK
26/01/2025 08:15:00,SITE_COM_001,1.404,236.5,49.92,OK
25/01/2025 17:45:00,SITE_RES_001,0.158,220.1,50.03,OK
2025-01-15T08:30:00,SITE_RES_001,0.398,217.2,49.7,OK
2025-01-26T08:30:00,SITE_RES_001,0.425,238.0,50.37,OK
04/01/2025 13:00:00,SITE_COM_002,-888.0,233.0,49.89,ERROR
2025-01-18T07:30:00,SITE_COM_002,0.209,235.1,50.4,OK
2025-01-18 07:00:00,SITE_RES_001,0.277,249.8,49.95,OK
2025-01-20T18:15:00,SITE_RES_001,0.371,252.1,49.92,OK
2025-01-05 12:45:00,SITE_RES_001,0.176,226.0,50.32,OK
22/01/2025 09:00:00,SITE_COM_001,1.326,216.0,49.76,OK
28/01/2025 15:45:00,SITE_COM_002,0.865,239.3,49.72,OK
2025-01-05T13:15:00,SITE_RES_001,0.146,234.0,49.74,OK
2025-01-22T17:30:00,SITE_RES_001,0.201,220.3,49.7,OK
2025-01-22T18:45:00,SITE_RES_001,0.332,224.9,50.18,OK
2025-01-29T15:00:00,SITE_RES_002,0.127,241.4,49.88,OK
2025-01-19T09:30:00,SITE_COM_002,0.65,218.1,50.41,OK
18/01/2025 04:00:00,SITE_RES_001,0.151,237.0,49.69,OK
2025-01-13T20:30:00,SITE_IND_002,2.935,255.7,50.08,OK
2025-01-19T15:30:00,SITE_COM_001,4.861,249.2,49.81,OK
2025-01-03T08:00:00,SITE_COM_002,1.003,213.8,50.06,OK
2025-01-30T01:45:00,SITE_RES_002,0.146,235.0,50.08,OK
2025-01-19 09:30:00,SITE_IND_002,0.591,234.4,50.03,OK
26/01/2025 05:30:00,SITE_COM_001,0.195,224.4,50.33,OK
2025-01-05 07:45:00,SITE_RES_002,0.272,242.3,50.09,OK
2025-01-23 06:30:00,SITE_COM_002,0.158,235.0,49.94,OK
2025-01-06T08:15:00,SITE_IND_002,1.836,221.6,49.76,OK
2025-01-19 00:00:00,SITE_COM_002,0.15,227.9,50.01,OK
2025-01-04 19:00:00,SITE_RES_002,0.291,232.2,50.26,OK
14/01/2025 10:00:00,SITE_RES_001,0.184,224.0,49.98,OK
18/01/2025 23:15:00,SITE_COM_002,0.143,217.9,49.84,OK
2025-01-10 03:45:00,SITE_COM_002,0.182,227.0,49.76,OK
2025-01-30 11:00:00,SITE_RES_001,0.18,244.1,49.61,OK
2025-01-19T14:15:00,SITE_COM_001,1.504,222.2,50.26,OK
2025-01-04T17:00:00,SITE_RES_001,0.133,221.8,50.26,OK
2025-01-02T18:30:00,SITE_IND_001,3.667,226.7,49.98,OK
28/01/2025 06:30:00,SITE_IND_002,2.168,235.7,50.05,OK
2025-01-26T06:15:00,SITE_COM_002,0.168,241.1,49.81,OK
26/01/2025 09:15:00,SITE_COM_001,1.372,224.1,49.89,OK
2025-01-06 18:45:00,SITE_RES_002,0.265,240.0,49.84,OK
2025-01-17T17:00:00,SITE_IND_001,3.128,224.8,50.12,OK
2025-01-29T16:15:00,SITE_RES_001,0.178,217.2,49.74,OK
2025-01-27T18:15:00,SITE_IND_002,2.421,230.5,49.99,OK
2025-01-24 22:30:00,SITE_IND_002,1.03,248.4,50.14,OK
2025-01-17T12:00:00,SITE_IND_002,3.5,223.7,50.16,OK
2025-01-15 04:45:00,SITE_COM_001,0.227,223.4,49.88,OK
23/01/2025 08:30:00,SITE_IND_001,2.797,239.8,49.91,OK
2025-01-05T21:15:00,SITE_IND_001,1.447,216.9,50.04,OK
15/01/2025 06:15:00,SITE_COM_002,0.155,221.7,50.09,OK
24/01/2025 11:45:00,SITE_IND_001,,228.6,49.97,ERROR
04/01/2025 10:45:00,SITE_COM_002,1.065,233.4,49.88,OK
2025-01-30T23:30:00,SITE_COM_002,0.126,224.7,50.3,OK
30/01/2025 05:30:00,SITE_RES_001,0.213,226.3,50.06,OK
2025-01-17T16:45:00,SITE_RES_002,0.135,234.2,49.87,OK
2025-01-09T23:30:00,SITE_COM_001,0.132,218.9,49.92,OK
2025-01-13T00:30:00,SITE_IND_002,0.862,231.3,49.44,OK
2025-01-14T08:00:00,SITE_RES_002,0.295,240.8,49.76,OK
2025-01-07 05:45:00,SITE_IND_001,1.333,238.1,50.32,OK
2025-01-14 10:45:00,SITE_IND_002,2.97,222.9,50.07,OK
09/01/2025 06:45:00,SITE_IND_001,3.514,223.8,49.93,OK
2025-01-19T20:30:00,SITE_RES_001,0.348,238.1,50.09,OK
13/01/2025 05:30:00,SITE_RES_002,0.087,245.3,49.73,OK
18/01/2025 00:45:00,SITE_RES_001,0.126,229.9,49.88,OK
17/01/2025 04:00:00,SITE_IND_002,1.016,220.2,50.0,OK
25/01/2025 03:15:00,SITE_IND_002,0.968,214.6,49.65,OK
2025-01-16T06:45:00,SITE_IND_002,3.106,232.5,50.4,OK
2025-01-23T17:15:00,SITE_RES_001,0.145,229.3,50.03,OK
14/01/2025 11:15:00,SITE_RES_001,0.116,231.1,50.06,OK
2025-01-12T15:00:00,SITE_COM_001,1.308,240.6,49.81,OK
2025-01-17 09:45:00,SITE_COM_002,0.79,214.9,50.02,OK
2025-01-26 23:15:00,SITE_RES_001,0.197,221.2,49.87,OK
17/01/2025 16:30:00,SITE_IND_002,2.672,227.0,49.95,OK
2025-01-04T18:15:00,SITE_IND_002,0.859,234.4,49.73,OK
2025-01-20 13:15:00,SITE_RES_001,0.123,219.3,49.74,OK
14/01/2025 04:00:00,SITE_RES_001,0.12,217.4,49.91,OK
2025-01-03T23:15:00,SITE_IND_001,1.598,238.4,50.08,OK
2025-01-28T09:45:00,SITE_COM_001,1.353,227.0,50.24,OK
18/01/2025 20:30:00,SITE_IND_001,1.832,230.4,49.75,OK
11/01/2025 07:15:00,SITE_COM_001,0.2,233.5,50.17,OK
2025-01-28T16:00:00,SITE_COM_002,1.07,228.0,50.1,OK
2025-01-15T18:15:00,SITE_RES_001,0.392,219.1,49.66,OK
2025-01-06 22:30:00,SITE_COM_001,0.187,228.8,49.97,OK
30/01/2025 01:30:00,SITE_COM_001,0.221,227.6,49.81,OK
2025-01-21T22:15:00,SITE_IND_002,1.28,223.4,50.31,OK
2025-01-06T13:45:00,SITE_RES_001,0.166,230.6,49.96,OK
10/01/2025 01:30:00,SITE_COM_001,0.221,208.9,50.24,OK
25/01/2025 08:00:00,SITE_COM_001,1.307,230.6,50.11,OK
2025-01-26T10:00:00,SITE_COM_001,1.187,217.9,49.85,OK
2025-01-14 07:45:00,SITE_COM_001,0.167,231.0,50.41,OK
2025-01-11T20:30:00,SITE_IND_002,1.246,233.3,50.07,OK
2025-01-05T16:30:00,SITE_RES_001,0.118,217.3,49.82,OK
2025-01-29 10:30:00,SITE_COM_002,0.869,231.2,49.81,OK
2025-01-13T13:00:00,SITE_RES_002,0.13,223.1,49.55,OK
2025-01-08T19:30:00,SITE_IND_002,2.648,237.2,50.27,OK
2025-01-18T16:45:00,SITE_RES_001,0.191,228.1,50.09,OK
2025-01-27T19:30:00,SITE_IND_002,2.775,230.8,49.92,OK
05/01/2025 21:45:00,SITE_IND_001,1.998,216.5,49.94,OK
2025-01-05T05:45:00,SITE_COM_001,0.271,244.0,50.05,OK
2025-01-07T04:45:00,SITE_IND_002,9.1,227.5,49.7,OK
2025-01-14T10:00:00,SITE_IND_002,2.808,227.3,50.6,OK
07/01/2025 00:30:00,SITE_RES_001,0.191,232.2,50.17,OK
23/01/2025 22:00:00,SITE_RES_001,0.2,243.0,50.03,OK
02/01/2025 15:00:00,SITE_IND_002,2.216,247.4,49.94,OK
2025-01-30T17:15:00,SITE_COM_002,1.003,222.9,49.8,OK
07/01/2025 13:15:00,SITE_COM_001,1.057,225.4,50.07,OK
2025-01-01T12:00:00,SITE_COM_002,0.801,229.7,50.36,OK
13/01/2025 08:15:00,SITE_COM_002,1.129,227.5,50.27,OK
2025-01-10T22:30:00,SITE_COM_002,0.143,235.2,50.08,OK
2025-01-15T17:45:00,SITE_RES_002,0.14,225.2,50.49,OK
08/01/2025 02:45:00,SITE_COM_001,0.207,229.2,50.26,OK
2025-01-29 18:45:00,SITE_RES_001,0.343,225.8,49.97,OK
2025-01-17 09:30:00,SITE_IND_002,2.606,235.0,50.11,OK
2025-01-08T02:00:00,SITE_RES_001,1.371,238.6,49.66,OK
2025-01-09 14:00:00,SITE_RES_002,0.126,242.8,50.01,OK
08/01/2025 23:00:00,SITE_IND_002,0.918,246.8,49.7,OK
2025-01-22 03:45:00,SITE_RES_002,0.096,215.4,50.08,OK
30/01/2025 10:15:00,SITE_COM_001,0.949,231.0,50.08,OK
2025-01-02T11:30:00,SITE_RES_001,0.181,227.7,50.01,OK
2025-01-03T08:15:00,SITE_IND_001,3.113,231.8,50.09,OK
2025-01-20T16:15:00,SITE_COM_002,0.889,237.9,49.91,OK
08/01/2025 10:30:00,SITE_COM_001,1.202,216.0,50.33,OK
2025-01-23 15:15:00,SITE_IND_001,3.579,230.8,50.11,OK
2025-01-06T18:15:00,SITE_RES_002,0.267,220.9,50.14,OK
09/01/2025 06:15:00,SITE_RES_001,0.174,232.6,49.96,OK
2025-01-02T22:15:00,SITE_RES_001,0.135,242.3,49.81,OK
18/01/2025 23:15:00,SITE_RES_001,0.186,212.5,50.03,OK
2025-01-18 20:00:00,SITE_IND_001,1.581,222.1,50.0,OK
2025-01-23T15:45:00,SITE_RES_001,0.14,236.2,50.06,OK
19/01/2025 12:30:00,SITE_COM_002,,215.4,49.93,ERROR
2025-01-24 16:45:00,SITE_RES_002,0.141,225.9,49.78,OK
2025-01-06T04:45:00,SITE_RES_001,0.16,231.0,50.23,OK
2025-01-25T21:00:00,SITE_RES_002,0.113,222.8,49.76,OK
2025-01-03T12:15:00,SITE_RES_001,0.111,230.5,49.95,OK
2025-01-18T07:15:00,SITE_IND_002,0.994,243.2,49.98,OK
03/01/2025 06:45:00,SITE_IND_002,2.786,235.4,50.09,OK
2025-01-10T18:45:00,SITE_RES_001,0.415,225.3,49.89,OK
06/01/2025 10:00:00,SITE_IND_001,4.248,244.1,49.99,OK
2025-01-21T04:00:00,SITE_COM_002,0.157,231.3,50.0,OK
2025-01-15 02:45:00,SITE_COM_001,0.24,235.3,49.86,OK
2025-01-25 23:30:00,SITE_COM_002,-999.0,224.9,49.91,ERROR
2025-01-09T17:15:00,SITE_COM_002,0.797,213.0,50.21,OK
2025-01-02T17:45:00,SITE_IND_001,3.755,214.5,50.22,OK
2025-01-09T07:00:00,SITE_COM_002,0.138,220.7,50.24,OK
2025-01-27T19:30:00,SITE_RES_001,0.24,229.9,49.93,OK
2025-01-13T15:15:00,SITE_IND_001,3.172,221.8,49.92,OK
2025-01-08T09:45:00,SITE_COM_002,0.857,226.1,50.04,OK
2025-01-22T17:45:00,SITE_COM_001,0.87,247.6,50.2,OK
13/01/2025 18:15:00,SITE_IND_002,9.068,237.0,49.65,OK
2025-01-16T17:00:00,SITE_COM_001,,243.0,49.89,ERROR
2025-01-12 00:30:00,SITE_COM_002,0.162,233.9,50.41,OK
2025-01-25 18:45:00,SITE_IND_001,1.675,220.6,49.89,OK
2025-01-11T17:45:00,SITE_IND_001,2.067,231.3,49.88,OK
2025-01-08T05:30:00,SITE_COM_001,0.194,218.4,50.1,OK
2025-01-11 20:45:00,SITE_IND_001,1.257,234.8,49.87,OK
2025-01-01T00:45:00,SITE_IND_002,1.001,233.3,50.2,OK
2025-01-24T15:45:00,SITE_IND_001,3.53,231.1,50.1,OK
2025-01-17T12:45:00,SITE_IND_001,3.935,214.2,50.12,OK
2025-01-29T15:30:00,SITE_RES_001,0.143,233.4,49.91,OK
2025-01-02T16:15:00,SITE_RES_002,0.134,236.9,50.37,OK
14/01/2025 06:00:00,SITE_COM_002,0.165,251.1,49.91,OK
2025-01-16T11:30:00,SITE_IND_002,3.263,239.4,49.78,OK
23/01/2025 16:00:00,SITE_IND_001,3.993,253.3,50.02,OK
13/01/2025 01:30:00,SITE_COM_001,0.16,227.1,50.15,OK
03/01/2025 08:15:00,SITE_RES_002,0.272,231.9,50.06,OK
2025-01-13T19:00:00,SITE_IND_002,1.892,220.7,50.24,OK
2025-01-28 12:30:00,SITE_IND_002,-888.0,252.0,50.02,ERROR
2025-01-08T00:00:00,SITE_IND_001,1.803,224.0,50.14,OK
2025-01-11 15:30:00,SITE_RES_002,0.131,241.0,49.73,OK
2025-01-14T23:00:00,SITE_RES_002,0.123,235.9,50.17,OK
28/01/2025 04:45:00,SITE_IND_002,6.043,237.4,50.2,OK
2025-01-22T00:45:00,SITE_RES_002,0.138,226.5,50.02,OK
2025-01-13T20:45:00,SITE_COM_001,0.203,215.1,49.96,OK
2025-01-16T07:15:00,SITE_RES_001,0.384,248.9,49.96,OK
2025-01-07T16:45:00,SITE_COM_001,1.176,234.6,49.91,OK
2025-01-29T14:45:00,SITE_COM_002,0.875,233.7,49.57,OK
2025-01-17T13:15:00,SITE_IND_001,4.822,231.3,49.92,OK
02/01/2025 16:00:00,SITE_IND_001,2.325,208.8,49.88,OK
30/01/2025 10:00:00,SITE_RES_002,0.101,212.0,50.08,OK
2025-01-24T22:15:00,SITE_RES_001,0.175,215.7,50.05,OK
2025-01-19T21:00:00,SITE_IND_002,0.915,222.0,49.72,OK
2025-01-09T09:00:00,SITE_IND_001,2.726,228.4,49.83,OK
2025-01-07 16:15:00,SITE_IND_001,3.829,243.7,49.87,OK
19/01/2025 14:30:00,SITE_RES_002,0.138,236.0,49.85,OK
2025-01-20 03:00:00,SITE_COM_002,0.179,237.6,49.93,OK
25/01/2025 01:15:00,SITE_COM_002,0.151,208.8,50.11,OK
24/01/2025 17:15:00,SITE_COM_001,1.107,229.0,50.1,OK
15/01/2025 06:00:00,SITE_IND_002,2.585,236.1,49.92,OK
2025-01-26 23:30:00,SITE_COM_002,0.143,229.2,50.17,OK
18/01/2025 21:45:00,SITE_RES_002,0.128,245.9,50.15,OK
2025-01-24T09:45:00,SITE_IND_002,2.861,235.6,50.42,OK
10/01/2025 15:00:00,SITE_RES_002,0.11,234.2,50.04,OK
18/01/2025 09:15:00,SITE_COM_002,0.904,233.2,49.57,OK
2025-01-13 07:45:00,SITE_COM_002,0.138,220.0,49.75,OK
24/01/2025 02:30:00,SITE_RES_002,0.158,225.5,50.0,OK
03/01/2025 17:30:00,SITE_RES_001,0.198,230.2,49.76,OK
2025-01-08T15:30:00,SITE_COM_002,1.094,239.0,49.97,OK
2025-01-30 19:00:00,SITE_COM_001,1.216,245.3,49.77,OK
2025-01-16 01:00:00,SITE_RES_001,0.172,230.8,49.82,OK
2025-01-13T08:00:00,SITE_RES_002,0.243,206.5,49.81,OK
26/01/2025 11:45:00,SITE_COM_001,1.279,229.9,50.26,OK
2025-01-23 01:00:00,SITE_COM_001,0.215,223.0,49.93,OK
2025-01-11 17:15:00,SITE_RES_001,0.158,234.0,49.77,OK
30/01/2025 09:45:00,SITE_RES_001,0.169,234.2,49.72,OK
2025-01-03 11:15:00,SITE_RES_002,0.093,241.6,50.19,OK
2025-01-20 11:15:00,SITE_IND_002,2.427,253.4,50.09,OK
09/01/2025 07:30:00,SITE_IND_002,2.325,244.5,49.78,OK
2025-01-20 06:00:00,SITE_RES_001,0.196,242.1,50.18,OK
2025-01-30T12:15:00,SITE_COM_001,1.185,204.5,49.83,OK
2025-01-25T12:45:00,SITE_RES_001,0.182,242.3,49.95,OK
2025-01-07T08:45:00,SITE_COM_001,1.395,227.9,49.91,OK
2025-01-09T16:15:00,SITE_IND_002,2.932,221.2,49.97,OK
30/01/2025 07:00:00,SITE_RES_001,-888.0,224.9,49.77,ERROR
19/01/2025 02:00:00,SITE_IND_002,0.97,216.3,50.12,OK
18/01/2025 01:00:00,SITE_IND_001,1.658,236.5,50.14,OK
2025-01-02T03:15:00,SITE_COM_002,0.084,236.6,50.04,OK
18/01/2025 03:15:00,SITE_COM_001,0.211,218.5,50.01,OK
04/01/2025 07:00:00,SITE_RES_002,0.273,226.6,49.58,OK
2025-01-02T07:15:00,SITE_IND_002,2.446,217.5,50.07,OK
2025-01-24 14:00:00,SITE_COM_002,0.867,229.5,50.01,OK
2025-01-07T21:15:00,SITE_RES_002,0.107,219.0,50.05,OK
08/01/2025 16:45:00,SITE_COM_001,1.469,216.4,49.88,OK
08/01/2025 06:30:00,SITE_RES_002,0.099,233.5,49.92,OK
2025-01-08T19:45:00,SITE_RES_001,0.438,238.7,50.34,OK
2025-01-26 09:45:00,SITE_COM_002,1.061,238.4,49.79,OK
10/01/2025 23:30:00,SITE_COM_002,0.158,222.8,50.13,OK
20/01/2025 09:00:00,SITE_IND_001,3.576,247.9,49.93,OK
2025-01-14 06:15:00,SITE_COM_001,0.165,223.1,49.92,OK
2025-01-20 01:00:00,SITE_COM_001,0.228,224.9,50.09,OK
02/01/2025 16:15:00,SITE_RES_001,0.147,233.6,49.85,OK
14/01/2025 22:15:00,SITE_COM_002,0.159,227.8,49.9,OK
12/01/2025 02:45:00,SITE_COM_002,0.141,250.9,49.54,OK
2025-01-21T00:45:00,SITE_COM_001,0.186,243.0,49.82,OK
09/01/2025 04:30:00,SITE_RES_002,0.149,219.6,50.04,OK
11/01/2025 14:45:00,SITE_RES_002,0.104,230.7,50.34,OK
28/01/2025 23:45:00,SITE_COM_001,0.239,214.3,49.9,OK
2025-01-07T06:00:00,SITE_IND_002,2.466,239.3,49.87,OK
2025-01-13T22:45:00,SITE_IND_002,0.942,226.4,50.13,OK
16/01/2025 07:30:00,SITE_COM_001,0.209,221.2,49.94,OK
2025-01-26 23:45:00,SITE_IND_002,0.841,236.7,49.95,OK
25/01/2025 09:00:00,SITE_RES_001,,243.0,49.82,ERROR
12/01/2025 05:15:00,SITE_RES_001,0.127,229.2,50.15,OK
2025-01-14 02:45:00,SITE_IND_001,1.69,232.6,49.73,OK
2025-01-19T05:15:00,SITE_IND_001,1.819,244.9,49.95,OK
02/01/2025 00:00:00,SITE_IND_001,1.583,248.4,49.96,OK
2025-01-19 17:00:00,SITE_COM_002,1.059,241.2,50.13,OK
12/01/2025 11:45:00,SITE_IND_002,1.052,209.2,49.94,OK
2025-01-18T17:15:00,SITE_IND_001,1.67,240.1,50.16,OK
08/01/2025 11:15:00,SITE_COM_001,1.513,258.4,49.94,OK
13/01/2025 08:15:00,SITE_COM_001,1.164,254.2,50.09,OK
2025-01-29 19:15:00,SITE_RES_001,0.441,229.2,50.02,OK
2025-01-22T20:00:00,SITE_COM_001,0.208,236.6,49.73,OK
2025-01-09T07:45:00,SITE_IND_001,4.373,235.4,50.29,OK
2025-01-24 05:00:00,SITE_COM_002,0.133,231.8,50.14,OK
16/01/2025 13:45:00,SITE_RES_001,0.142,241.6,50.0,OK
08/01/2025 12:00:00,SITE_RES_002,0.134,237.9,49.77,OK
2025-01-06T07:15:00,SITE_RES_001,0.466,226.2,50.25,OK
24/01/2025 00:30:00,SITE_COM_001,0.178,241.3,50.03,OK
2025-01-29T12:15:00,SITE_RES_001,0.144,238.3,49.9,OK
2025-01-20T17:00:00,SITE_COM_002,0.962,233.1,50.1,OK
21/01/2025 15:00:00,SITE_IND_001,3.534,209.9,50.16,OK
2025-01-01T17:30:00,SITE_RES_001,0.134,226.8,50.24,OK
24/01/2025 02:30:00,SITE_COM_001,0.159,209.1,50.43,OK
2025-01-22T01:00:00,SITE_IND_002,1.025,227.7,49.94,OK
2025-01-03T12:00:00,SITE_RES_001,0.178,232.0,50.09,OK
2025-01-24T11:30:00,SITE_IND_002,2.328,240.6,50.27,OK
2025-01-06 21:45:00,SITE_IND_001,4.296,214.9,50.0,OK
04/01/2025 10:30:00,SITE_IND_002,0.807,234.9,50.17,OK
2025-01-01 09:00:00,SITE_IND_002,2.864,227.3,49.78,OK
2025-01-22T21:15:00,SITE_IND_001,3.172,226.7,49.76,OK
2025-01-08T18:00:00,SITE_IND_001,-777.0,219.8,50.07,ERROR
2025-01-03T10:00:00,SITE_RES_001,0.15,229.4,50.08,OK
19/01/2025 02:00:00,SITE_RES_002,0.121,243.6,49.84,OK
27/01/2025 14:00:00,SITE_COM_001,,232.7,50.12,ERROR
2025-01-15 04:00:00,SITE_RES_001,0.119,211.9,49.58,OK
2025-01-15T12:45:00,SITE_COM_001,1.104,235.1,50.06,OK
13/01/2025 08:15:00,SITE_RES_002,0.241,226.9,50.02,OK
2025-01-26T10:30:00,SITE_RES_002,0.117,223.5,50.17,OK
20/01/2025 03:00:00,SITE_RES_001,0.161,245.7,50.26,OK
04/01/2025 16:45:00,SITE_COM_002,0.706,233.3,49.84,OK
08/01/2025 13:15:00,SITE_COM_001,-999.0,219.1,49.97,ERROR
2025-01-24T18:45:00,SITE_IND_002,1.596,226.8,49.82,OK
2025-01-04T05:30:00,SITE_COM_001,0.181,202.6,50.24,OK
2025-01-30T13:30:00,SITE_IND_001,2.966,239.3,50.13,OK
2025-01-14T17:45:00,SITE_RES_002,0.134,229.3,49.94,OK
2025-01-19 21:45:00,SITE_COM_001,0.165,237.2,50.19,OK
11/01/2025 14:15:00,SITE_COM_002,0.798,240.3,50.46,OK
2025-01-11T08:45:00,SITE_RES_002,0.292,229.4,49.82,OK
2025-01-14T09:45:00,SITE_IND_001,3.773,217.6,50.13,OK
11/01/2025 14:45:00,SITE_RES_001,0.132,248.4,50.32,OK
2025-01-29T18:30:00,SITE_IND_001,3.215,236.0,49.92,OK
02/01/2025 19:00:00,SITE_COM_001,1.497,240.7,49.85,OK
24/01/2025 11:00:00,SITE_RES_002,0.121,221.7,49.94,OK
2025-01-26T07:15:00,SITE_IND_002,,227.3,49.88,ERROR
2025-01-21 19:15:00,SITE_IND_001,4.147,217.7,50.23,OK
2025-01-23 05:00:00,SITE_RES_001,0.143,245.2,49.69,OK
2025-01-24T01:00:00,SITE_COM_002,,243.4,50.04,ERROR
2025-01-21 11:45:00,SITE_RES_002,0.127,227.0,50.11,OK
2025-01-18T06:45:00,SITE_IND_001,1.855,241.3,50.01,OK
2025-01-04 17:30:00,SITE_RES_001,0.132,240.0,49.86,OK
07/01/2025 08:45:00,SITE_COM_002,0.801,229.4,49.98,OK
2025-01-24T05:00:00,SITE_RES_001,0.178,234.1,49.91,OK
2025-01-06 05:00:00,SITE_IND_001,1.672,240.7,50.1,OK
21/01/2025 22:15:00,SITE_COM_001,0.196,226.6,49.78,OK
04/01/2025 00:45:00,SITE_IND_002,0.917,237.5,50.13,OK
2025-01-12T13:30:00,SITE_IND_001,1.717,235.1,49.85,OK
2025-01-21T08:30:00,SITE_RES_002,0.273,229.1,49.78,OK
03/01/2025 05:45:00,SITE_IND_001,1.187,231.6,49.78,OK
2025-01-21 16:00:00,SITE_COM_001,0.981,249.1,50.04,OK
2025-01-06T14:45:00,SITE_IND_001,3.808,230.1,50.11,OK
2025-01-16T10:45:00,SITE_RES_002,0.144,242.0,50.23,OK
02/01/2025 07:00:00,SITE_IND_001,2.466,238.9,49.76,OK
2025-01-27T00:45:00,SITE_IND_002,1.023,219.6,50.19,OK
2025-01-26 08:15:00,SITE_COM_002,1.008,250.8,50.06,OK
29/01/2025 14:30:00,SITE_RES_001,0.191,209.8,49.94,OK
2025-01-15T20:00:00,SITE_COM_001,0.173,238.1,49.98,OK
19/01/2025 01:30:00,SITE_IND_001,1.588,227.4,49.7,OK
26/01/2025 10:00:00,SITE_RES_001,0.157,232.2,50.13,OK
2025-01-05T23:15:00,SITE_COM_001,0.258,231.4,49.98,OK
2025-01-02 06:15:00,SITE_COM_002,0.144,225.7,50.12,OK
09/01/2025 23:15:00,SITE_RES_001,0.184,246.9,49.93,OK
2025-01-15T21:30:00,SITE_COM_001,0.208,228.2,50.17,OK
24/01/2025 10:45:00,SITE_RES_002,0.087,230.3,50.24,OK
2025-01-18 12:00:00,SITE_RES_001,0.129,248.6,49.81,OK
2025-01-26 06:45:00,SITE_COM_001,0.188,224.2,50.17,OK
27/01/2025 09:30:00,SITE_IND_001,4.066,227.8,49.91,OK
2025-01-09T02:45:00,SITE_RES_002,0.113,238.5,50.11,OK
07/01/2025 08:15:00,SITE_RES_001,0.342,232.5,50.15,OK
24/01/2025 17:00:00,SITE_COM_001,1.316,225.9,50.14,OK
2025-01-19 23:30:00,SITE_COM_001,-777.0,217.7,49.7,ERROR
30/01/2025 07:00:00,SITE_IND_001,2.786,223.1,49.81,OK
2025-01-06T02:00:00,SITE_COM_001,0.137,225.8,50.01,OK
2025-01-05T23:15:00,SITE_IND_001,1.919,208.6,49.86,OK
15/01/2025 13:30:00,SITE_COM_001,1.253,237.7,49.96,OK
2025-01-14T18:00:00,SITE_IND_001,2.827,229.3,49.89,OK
18/01/2025 05:45:00,SITE_COM_001,4.683,227.5,50.28,OK
2025-01-21T09:30:00,SITE_RES_002,0.121,221.6,49.68,OK
02/01/2025 10:45:00,SITE_COM_001,0.957,216.8,50.1,OK
04/01/2025 17:15:00,SITE_RES_001,0.172,235.3,49.62,OK
17/01/2025 07:00:00,SITE_IND_001,3.903,223.9,49.98,OK
23/01/2025 14:15:00,SITE_COM_002,0.997,223.2,50.03,OK
2025-01-17 07:30:00,SITE_RES_001,0.298,241.5,49.62,OK
16/01/2025 15:30:00,SITE_COM_002,0.554,214.4,50.06,OK
12/01/2025 06:45:00,SITE_IND_001,13.643,222.0,50.07,OK
2025-01-16 23:00:00,SITE_COM_002,0.178,233.2,50.0,OK
2025-01-17T16:00:00,SITE_RES_002,0.119,237.9,49.78,OK
02/01/2025 19:00:00,SITE_COM_001,1.497,240.7,49.85,OK
2025-01-15T15:30:00,SITE_RES_001,0.157,211.6,50.17,OK
2025-01-09 16:45:00,SITE_COM_001,1.208,216.6,49.77,OK
2025-01-14 13:00:00,SITE_IND_002,2.609,220.1,49.82,OK
2025-01-08 20:30:00,SITE_COM_002,0.129,200.3,50.27,OK
2025-01-19 21:30:00,SITE_RES_002,0.139,222.8,49.77,OK
2025-01-16T09:30:00,SITE_COM_001,1.294,237.9,50.01,OK
2025-01-29 22:15:00,SITE_RES_001,0.166,245.2,50.02,OK
2025-01-19T17:00:00,SITE_COM_001,1.277,230.6,49.96,OK
2025-01-03T19:00:00,SITE_COM_002,0.984,210.9,50.02,OK
06/01/2025 03:15:00,SITE_IND_002,0.857,235.7,49.87,OK
2025-01-03 18:15:00,SITE_COM_002,0.471,232.8,50.06,OK
2025-01-13T18:00:00,SITE_IND_001,3.711,231.4,50.29,OK
2025-01-21 19:00:00,SITE_COM_001,1.192,239.7,50.04,OK
2025-01-03T12:30:00,SITE_RES_001,0.144,232.2,49.65,OK
2025-01-20T00:30:00,SITE_COM_002,0.155,221.1,49.76,OK
2025-01-04 11:30:00,SITE_RES_002,0.093,210.3,49.88,OK
2025-01-12T20:30:00,SITE_RES_001,0.468,226.9,50.03,OK
2025-01-29T22:00:00,SITE_COM_002,0.146,245.3,49.5,OK
2025-01-18T19:15:00,SITE_RES_002,0.194,222.6,49.8,OK
2025-01-21 18:30:00,SITE_COM_002,3.986,237.3,49.97,OK
30/01/2025 07:30:00,SITE_IND_001,2.773,226.4,49.98,OK
2025-01-04T13:15:00,SITE_RES_002,0.104,237.2,50.09,OK
2025-01-04T14:00:00,SITE_RES_002,0.122,229.4,49.87,OK
2025-01-22T19:30:00,SITE_RES_002,0.26,236.5,49.96,OK
29/01/2025 11:00:00,SITE_RES_001,0.149,239.9,50.25,OK
2025-01-14T11:00:00,SITE_IND_002,2.196,249.3,50.1,OK
2025-01-26T16:45:00,SITE_RES_001,0.127,244.6,50.24,OK
2025-01-04T00:00:00,SITE_COM_001,0.181,229.6,50.11,OK
2025-01-06 14:15:00,SITE_IND_001,3.44,226.2,49.82,OK
2025-01-28T10:15:00,SITE_IND_002,3.071,235.9,50.15,OK
2025-01-29T11:00:00,SITE_RES_002,0.108,213.8,50.25,OK
2025-01-30T01:30:00,SITE_RES_002,0.08,203.7,50.13,OK
2025-01-20 08:15:00,SITE_RES_002,0.201,223.7,49.99,OK
2025-01-17T06:45:00,SITE_COM_001,0.223,231.9,49.97,OK
2025-01-26T21:00:00,SITE_COM_002,0.136,208.4,49.85,OK
2025-01-10T09:30:00,SITE_IND_001,3.526,241.4,50.23,OK
2025-01-27 15:15:00,SITE_COM_001,1.042,221.8,50.19,OK
2025-01-10T11:15:00,SITE_COM_001,0.975,230.2,50.17,OK
2025-01-13T15:30:00,SITE_IND_002,2.927,218.9,50.36,OK
2025-01-24 14:15:00,SITE_RES_002,0.104,225.9,49.76,OK
2025-01-23T21:45:00,SITE_RES_002,0.132,230.9,49.92,OK
30/01/2025 06:30:00,SITE_RES_001,0.136,222.9,49.83,OK
2025-01-12T14:45:00,SITE_IND_001,1.667,236.8,50.02,OK
2025-01-28T02:00:00,SITE_RES_002,0.112,246.8,49.66,OK
2025-01-10T22:45:00,SITE_RES_001,0.135,230.2,49.73,OK
22/01/2025 21:00:00,SITE_COM_002,0.151,232.8,49.97,OK
2025-01-11T12:30:00,SITE_IND_002,0.964,227.3,49.88,OK
17/01/2025 00:45:00,SITE_COM_001,0.229,222.8,49.99,OK
2025-01-29 13:45:00,SITE_RES_002,0.135,232.5,49.98,OK
2025-01-04T17:00:00,SITE_IND_001,1.402,231.8,50.09,OK
2025-01-13T06:45:00,SITE_COM_002,0.127,225.0,50.01,OK
28/01/2025 22:45:00,SITE_IND_002,1.055,237.6,49.6,OK
2025-01-17T03:30:00,SITE_RES_001,0.163,230.3,49.9,OK
2025-01-19T08:30:00,SITE_COM_001,1.125,231.4,49.86,OK
2025-01-04T23:45:00,SITE_COM_001,0.228,230.6,50.08,OK
2025-01-16T05:45:00,SITE_IND_001,1.574,223.0,50.32,OK
20/01/2025 21:45:00,SITE_COM_001,0.236,219.8,50.26,OK
2025-01-09T08:00:00,SITE_IND_001,3.472,217.0,50.17,OK
2025-01-05T18:00:00,SITE_RES_001,0.301,239.7,50.11,OK
2025-01-10T19:15:00,SITE_RES_002,0.38,238.8,50.11,OK
2025-01-10T13:30:00,SITE_RES_001,0.147,239.4,49.55,OK
2025-01-09T04:45:00,SITE_COM_001,0.236,249.0,49.68,OK
2025-01-04T12:00:00,SITE_RES_001,0.161,237.2,49.93,OK
2025-01-21T10:00:00,SITE_RES_001,0.138,222.4,49.83,OK
21/01/2025 17:45:00,SITE_IND_002,2.05,240.4,50.14,OK
21/01/2025 13:00:00,SITE_IND_001,4.197,227.4,50.11,OK
2025-01-22T19:30:00,SITE_COM_001,1.256,247.7,50.17,OK
2025-01-02 23:30:00,SITE_RES_001,0.173,229.0,50.45,OK
24/01/2025 02:30:00,SITE_IND_001,1.632,232.1,49.88,OK
2025-01-06 03:15:00,SITE_IND_001,1.604,226.7,49.94,OK
2025-01-27 21:15:00,SITE_COM_001,0.189,224.1,49.89,OK
2025-01-13T06:15:00,SITE_IND_002,2.266,228.4,50.01,OK
04/01/2025 21:45:00,SITE_RES_002,0.127,251.4,50.06,OK
2025-01-29 08:45:00,SITE_IND_001,3.73,245.4,50.07,OK
2025-01-27T17:00:00,SITE_IND_001,4.286,231.2,49.9,OK
2025-01-25T19:45:00,SITE_RES_001,0.351,233.5,50.22,OK
2025-01-30 13:15:00,SITE_COM_001,1.252,230.5,49.92,OK
2025-01-12T17:00:00,SITE_COM_001,1.303,235.3,49.67,OK
2025-01-22T17:45:00,SITE_COM_002,0.808,238.3,50.26,OK
2025-01-15T20:15:00,SITE_COM_001,0.195,250.9,49.93,OK
03/01/2025 02:15:00,SITE_COM_001,0.257,220.5,49.83,OK
2025-01-29 07:00:00,SITE_IND_002,,233.0,49.81,ERROR
2025-01-30 12:00:00,SITE_IND_002,,220.0,49.71,ERROR
20/01/2025 12:15:00,SITE_RES_001,0.178,243.9,50.17,OK
24/01/2025 16:00:00,SITE_IND_001,4.249,213.8,50.07,OK
2025-01-14T14:15:00,SITE_IND_002,2.493,241.6,49.85,OK
04/01/2025 14:30:00,SITE_COM_001,1.16,239.7,49.87,OK
2025-01-19T03:45:00,SITE_RES_002,0.107,211.2,50.16,OK
2025-01-24 13:30:00,SITE_RES_001,0.162,228.2,50.11,OK
02/01/2025 16:15:00,SITE_IND_002,2.294,224.3,50.07,OK
2025-01-26T05:00:00,SITE_IND_001,1.19,212.4,49.94,OK
06/01/2025 05:15:00,SITE_RES_002,0.099,229.7,50.08,OK
01/01/2025 13:15:00,SITE_RES_002,0.094,231.3,49.86,OK
20/01/2025 08:45:00,SITE_IND_002,1.868,243.5,49.8,OK
2025-01-29T04:15:00,SITE_RES_002,0.154,224.6,49.99,OK
2025-01-08T20:15:00,SITE_IND_001,2.709,225.8,49.65,OK
2025-01-28T22:30:00,SITE_COM_002,0.129,226.3,49.77,OK
2025-01-23 22:00:00,SITE_COM_002,0.134,232.5,49.92,OK
12/01/2025 19:30:00,SITE_IND_002,1.105,235.2,50.12,OK
26/01/2025 02:15:00,SITE_RES_001,0.132,225.0,49.91,OK
2025-01-24T14:15:00,SITE_IND_001,3.836,220.5,50.32,OK
2025-01-02T13:45:00,SITE_IND_002,2.264,219.4,50.3,OK
2025-01-15T23:00:00,SITE_RES_002,0.11,231.6,50.05,OK
26/01/2025 09:00:00,SITE_COM_002,0.955,223.0,49.82,OK
2025-01-28 12:30:00,SITE_IND_002,-888.0,252.0,50.02,ERROR
2025-01-05T23:45:00,SITE_RES_002,0.1,235.1,49.88,OK
2025-01-18 17:30:00,SITE_RES_002,0.084,226.8,49.59,OK
2025-01-21T12:30:00,SITE_COM_001,0.83,227.7,50.49,OK
2025-01-26T21:15:00,SITE_COM_001,0.214,233.7,49.75,OK
2025-01-11T18:15:00,SITE_RES_001,0.539,219.1,50.26,OK
2025-01-24T04:45:00,SITE_IND_002,0.884,227.7,49.75,OK
2025-01-11 23:15:00,SITE_RES_002,0.106,245.3,50.29,OK
2025-01-03T16:45:00,SITE_IND_001,10.703,225.3,50.14,OK
20/01/2025 15:30:00,SITE_IND_001,2.873,241.8,50.02,OK
2025-01-25T03:15:00,SITE_RES_002,0.138,217.1,50.02,OK
06/01/2025 22:30:00,SITE_IND_002,1.025,237.6,50.08,OK
2025-01-04T11:15:00,SITE_RES_002,0.105,229.4,50.09,OK
2025-01-05 13:15:00,SITE_IND_001,1.694,238.1,49.77,OK
2025-01-01 03:00:00,SITE_IND_001,1.326,227.6,49.9,OK
19/01/2025 05:15:00,SITE_IND_002,1.049,225.1,49.94,OK
2025-01-14T17:45:00,SITE_COM_002,0.737,233.6,50.17,OK
2025-01-28T22:30:00,SITE_IND_001,1.334,231.2,49.82,OK
2025-01-16T13:15:00,SITE_RES_001,0.148,228.7,50.21,OK
2025-01-20 14:30:00,SITE_IND_001,4.005,233.0,49.83,OK
2025-01-22T20:45:00,SITE_RES_001,0.438,222.5,49.6,OK
07/01/2025 22:00:00,SITE_COM_001,0.175,240.7,50.0,OK
2025-01-09 19:15:00,SITE_IND_002,2.795,233.6,50.33,OK
2025-01-20 03:45:00,SITE_COM_002,0.125,226.8,50.22,OK
09/01/2025 02:30:00,SITE_RES_001,0.182,234.5,49.92,OK
07/01/2025 18:30:00,SITE_COM_001,1.063,236.2,50.23,OK
2025-01-25T15:15:00,SITE_RES_001,0.13,226.2,50.06,OK
12/01/2025 06:00:00,SITE_IND_001,,228.4,50.15,ERROR
09/01/2025 21:00:00,SITE_RES_001,0.122,213.5,49.92,OK
2025-01-05T19:45:00,SITE_COM_002,0.72,210.1,50.07,OK
05/01/2025 14:00:00,SITE_IND_002,1.253,226.8,50.12,OK
15/01/2025 02:15:00,SITE_RES_001,0.121,236.1,49.67,OK
06/01/2025 07:45:00,SITE_COM_002,,232.5,50.18,ERROR
2025-01-24 21:00:00,SITE_RES_002,0.104,225.2,50.01,OK
2025-01-10T00:30:00,SITE_COM_001,0.205,248.5,50.08,OK
09/01/2025 09:45:00,SITE_RES_002,0.144,230.4,50.04,OK
2025-01-03T18:30:00,SITE_COM_002,0.637,209.5,50.15,OK
24/01/2025 15:15:00,SITE_RES_002,0.094,230.8,50.27,OK
2025-01-19T17:00:00,SITE_RES_001,0.162,226.4,50.14,OK
2025-01-30T06:15:00,SITE_RES_002,0.116,222.6,49.93,OK
2025-01-25 01:30:00,SITE_COM_001,0.225,220.5,49.92,OK
2025-01-11T23:00:00,SITE_COM_002,0.166,222.7,49.99,OK
2025-01-17T09:00:00,SITE_IND_001,3.774,216.9,49.93,OK
26/01/2025 18:30:00,SITE_IND_002,0.914,218.6,49.96,OK
03/01/2025 06:15:00,SITE_IND_002,2.179,215.8,50.04,OK
14/01/2025 00:45:00,SITE_RES_001,0.122,243.7,49.78,OK
2025-01-26 15:30:00,SITE_COM_002,0.943,222.2,50.0,OK
2025-01-26T00:00:00,SITE_IND_002,1.031,238.8,50.21,OK
25/01/2025 12:15:00,SITE_IND_002,0.962,244.9,49.53,OK
2025-01-22T06:15:00,SITE_RES_001,0.19,223.1,50.06,OK
2025-01-14T14:30:00,SITE_RES_002,0.113,234.1,50.12,OK
2025-01-04T22:15:00,SITE_RES_002,0.104,206.5,50.33,OK
2025-01-15 06:45:00,SITE_RES_002,0.129,215.5,50.02,OK
2025-01-24 18:00:00,SITE_COM_002,1.214,211.1,49.7,OK
2025-01-30T17:45:00,SITE_COM_002,0.724,241.1,49.93,OK
2025-01-08T04:45:00,SITE_COM_002,0.123,233.2,49.98,OK
08/01/2025 10:15:00,SITE_IND_001,3.761,219.2,49.8,OK
2025-01-15T18:30:00,SITE_RES_002,0.321,220.8,49.75,OK
2025-01-23 19:30:00,SITE_RES_001,0.386,227.0,49.69,OK
2025-01-11T18:00:00,SITE_IND_002,1.023,235.4,50.13,OK
2025-01-19 07:15:00,SITE_RES_002,0.268,229.2,49.78,OK
2025-01-24T18:00:00,SITE_RES_002,0.381,241.6,50.05,OK
2025-01-07T17:30:00,SITE_IND_002,2.328,254.3,50.07,OK
2025-01-16T17:45:00,SITE_RES_002,0.117,230.8,49.92,OK
2025-01-30T10:00:00,SITE_IND_001,3.702,231.3,50.17,OK
21/01/2025 04:00:00,SITE_RES_002,0.117,240.8,49.84,OK
2025-01-29T05:30:00,SITE_COM_001,0.232,226.6,50.39,OK
2025-01-22T01:15:00,SITE_IND_001,1.531,220.1,49.98,OK
2025-01-27T07:30:00,SITE_COM_002,0.122,213.8,50.11,OK
2025-01-17T00:45:00,SITE_RES_002,0.16,247.3,49.98,OK
2025-01-06 19:30:00,SITE_RES_001,0.387,213.2,50.1,OK
2025-01-04 01:30:00,SITE_COM_002,3.256,238.6,50.11,OK
2025-01-18T04:15:00,SITE_RES_002,0.134,237.1,49.9,OK
2025-01-12T19:45:00,SITE_RES_001,0.439,216.3,49.75,OK
02/01/2025 16:30:00,SITE_RES_002,-999.0,221.1,50.19,ERROR
2025-01-06T18:45:00,SITE_RES_001,0.364,231.1,50.24,OK
2025-01-15T19:00:00,SITE_COM_001,1.167,233.7,50.02,OK
2025-01-26 02:00:00,SITE_RES_001,0.148,225.4,50.41,OK
2025-01-24 12:15:00,SITE_RES_001,2.259,234.3,49.68,OK
20/01/2025 21:30:00,SITE_RES_002,0.121,218.8,50.19,OK
28/01/2025 15:45:00,SITE_RES_002,0.106,229.2,50.09,OK
2025-01-02T09:00:00,SITE_COM_002,0.798,227.7,49.82,OK
2025-01-03T00:15:00,SITE_IND_001,1.339,217.2,50.2,OK
2025-01-11 11:00:00,SITE_IND_001,,222.0,49.87,ERROR
29/01/2025 21:30:00,SITE_RES_001,0.179,221.0,49.76,OK
2025-01-11 19:45:00,SITE_IND_002,1.257,252.1,49.66,OK
2025-01-09T12:15:00,SITE_IND_002,2.446,217.2,49.89,OK
09/01/2025 05:30:00,SITE_COM_002,0.164,235.5,49.96,OK
2025-01-18T07:45:00,SITE_COM_001,0.192,243.9,49.63,OK
07/01/2025 06:15:00,SITE_COM_002,0.156,224.5,49.88,OK
2025-01-08T21:30:00,SITE_IND_001,4.175,225.3,50.0,OK
2025-01-15T06:30:00,SITE_RES_002,0.152,223.8,50.01,OK
2025-01-15T03:45:00,SITE_COM_002,0.147,234.2,50.3,OK
25/01/2025 13:15:00,SITE_IND_001,1.304,217.2,50.11,OK
2025-01-12T00:30:00,SITE_COM_001,0.174,228.5,49.98,OK
02/01/2025 21:15:00,SITE_RES_001,0.155,221.3,50.18,OK
2025-01-13 22:00:00,SITE_IND_002,1.295,232.0,50.41,OK
2025-01-30T22:30:00,SITE_IND_002,0.974,218.1,49.76,OK
29/01/2025 12:00:00,SITE_IND_001,3.198,239.3,49.67,OK
2025-01-22T09:15:00,SITE_COM_002,0.629,208.6,50.27,OK
2025-01-02T17:45:00,SITE_IND_001,3.755,214.5,50.22,OK
2025-01-29 14:15:00,SITE_IND_001,2.932,221.1,50.07,OK
19/01/2025 02:00:00,SITE_IND_002,0.97,216.3,50.12,OK
2025-01-06T20:15:00,SITE_IND_001,3.29,224.2,50.28,OK
2025-01-09T11:15:00,SITE_COM_002,0.83,231.0,50.37,OK
27/01/2025 22:15:00,SITE_RES_002,0.122,238.7,49.68,OK
06/01/2025 22:15:00,SITE_RES_001,0.161,216.5,50.14,OK
2025-01-20T17:00:00,SITE_COM_001,1.111,227.3,50.43,OK
2025-01-16T10:45:00,SITE_IND_001,-999.0,242.4,49.83,ERROR
2025-01-29T18:45:00,SITE_IND_001,3.348,199.2,49.73,OK
2025-01-23 14:15:00,SITE_IND_002,2.727,218.9,50.24,OK
2025-01-19 21:45:00,SITE_IND_001,1.471,231.3,50.11,OK
2025-01-20T20:45:00,SITE_COM_001,0.175,222.4,50.25,OK
19/01/2025 03:00:00,SITE_IND_001,1.491,216.6,49.97,OK
2025-01-10T13:00:00,SITE_IND_001,4.122,248.2,50.28,OK
2025-01-14T07:30:00,SITE_RES_001,0.401,229.7,50.23,OK
2025-01-06T15:30:00,SITE_RES_001,-999.0,212.3,49.22,ERROR
2025-01-10T13:15:00,SITE_COM_001,1.186,230.8,50.0,OK
2025-01-13 08:15:00,SITE_IND_001,4.447,226.9,50.16,OK
2025-01-13T20:30:00,SITE_RES_001,0.467,232.5,50.07,OK
2025-01-23T04:00:00,SITE_COM_001,0.174,215.1,50.18,OK
2025-01-02T00:15:00,SITE_RES_001,0.199,243.1,50.33,OK
2025-01-29T17:45:00,SITE_RES_001,0.167,240.7,49.95,OK
15/01/2025 14:00:00,SITE_RES_001,0.154,215.5,50.28,OK
2025-01-14T12:15:00,SITE_COM_001,1.433,237.4,50.31,OK
2025-01-26T04:30:00,SITE_RES_002,0.121,232.9,50.41,OK
2025-01-14T09:15:00,SITE_COM_001,-999.0,207.7,50.0,ERROR
2025-01-12T12:45:00,SITE_RES_002,0.129,239.6,50.06,OK
2025-01-23 03:15:00,SITE_RES_001,0.16,244.1,50.14,OK
2025-01-08 17:15:00,SITE_COM_001,1.224,233.6,50.0,OK
2025-01-04T23:45:00,SITE_IND_001,1.341,224.6,49.86,OK
2025-01-12T12:00:00,SITE_COM_002,0.993,243.5,50.29,OK
2025-01-24T23:00:00,SITE_COM_001,0.195,234.8,49.89,OK
2025-01-04 05:45:00,SITE_COM_002,0.141,239.0,50.01,OK
30/01/2025 15:15:00,SITE_COM_002,0.921,229.5,49.87,OK
2025-01-09 12:45:00,SITE_IND_002,2.487,237.0,49.52,OK
2025-01-28T08:45:00,SITE_IND_002,2.832,230.6,49.97,OK
11/01/2025 19:00:00,SITE_RES_001,0.443,211.4,49.86,OK
2025-01-15T12:00:00,SITE_COM_001,1.009,227.6,49.8,OK
2025-01-26T20:00:00,SITE_COM_002,0.196,239.1,50.08,OK
2025-01-15T09:30:00,SITE_IND_002,2.792,242.6,50.49,OK
2025-01-10 19:45:00,SITE_IND_001,2.811,234.9,50.22,OK
2025-01-11T18:30:00,SITE_IND_002,1.037,240.1,50.07,OK
2025-01-27T09:45:00,SITE_RES_001,0.175,238.0,50.13,OK
2025-01-11T22:15:00,SITE_RES_001,0.147,227.7,50.26,OK
2025-01-04T15:15:00,SITE_IND_002,0.953,219.6,50.14,OK
2025-01-05T00:15:00,SITE_RES_002,0.139,211.6,50.18,OK
2025-01-06T23:15:00,SITE_COM_002,0.144,231.8,49.74,OK
04/01/2025 01:30:00,SITE_RES_002,0.105,222.4,49.8,OK
2025-01-30T16:00:00,SITE_RES_002,0.13,225.9,50.08,OK
2025-01-30T05:15:00,SITE_RES_001,0.179,226.3,49.74,OK
09/01/2025 19:00:00,SITE_RES_002,0.32,257.0,49.98,OK
23/01/2025 17:00:00,SITE_IND_001,3.744,216.4,50.26,OK
10/01/2025 22:15:00,SITE_IND_002,-777.0,228.6,49.99,ERROR
2025-01-18T07:00:00,SITE_IND_001,1.822,234.0,50.26,OK
2025-01-25T21:00:00,SITE_COM_001,0.144,222.8,49.83,OK
15/01/2025 00:45:00,SITE_COM_002,0.141,229.8,50.35,OK
20/01/2025 02:00:00,SITE_IND_001,1.71,217.2,50.32,OK
2025-01-22 10:30:00,SITE_IND_001,4.046,235.1,49.72,OK
2025-01-30T09:15:00,SITE_COM_002,1.038,230.9,50.14,OK
23/01/2025 07:00:00,SITE_IND_001,2.264,217.4,50.1,OK
2025-01-28T02:45:00,SITE_RES_002,0.112,234.0,50.09,OK
2025-01-09 02:30:00,SITE_COM_002,0.126,226.6,49.99,OK
2025-01-05T12:30:00,SITE_IND_002,1.074,224.2,49.82,OK
2025-01-21T03:15:00,SITE_IND_001,-999.0,206.2,50.02,ERROR
2025-01-18T19:15:00,SITE_COM_001,1.166,246.7,50.04,OK
2025-01-29T12:00:00,SITE_IND_002,2.519,217.9,49.56,OK
2025-01-20T06:15:00,SITE_IND_002,3.209,242.5,50.41,OK
15/01/2025 22:30:00,SITE_COM_002,0.193,224.2,50.29,OK
2025-01-30 23:15:00,SITE_COM_002,0.136,230.0,50.33,OK
23/01/2025 14:45:00,SITE_IND_001,12.984,226.9,50.0,OK
2025-01-02T13:30:00,SITE_COM_001,1.226,230.2,49.93,OK
2025-01-30T00:45:00,SITE_RES_001,0.177,221.8,49.93,OK
2025-01-01 07:30:00,SITE_IND_002,2.98,205.3,49.84,OK
16/01/2025 13:15:00,SITE_IND_001,,234.7,50.03,ERROR
2025-01-27 14:45:00,SITE_RES_001,,226.6,49.99,ERROR
2025-01-26T18:15:00,SITE_IND_002,-999.0,241.1,49.67,ERROR
10/01/2025 16:45:00,SITE_IND_002,2.987,227.5,49.92,OK
05/01/2025 08:45:00,SITE_RES_001,0.451,232.6,50.26,OK
2025-01-12T12:15:00,SITE_RES_001,0.116,232.5,50.11,OK
2025-01-09T10:00:00,SITE_IND_002,2.446,235.7,49.9,OK
17/01/2025 13:45:00,SITE_IND_002,2.139,250.6,50.36,OK
2025-01-29T01:00:00,SITE_COM_001,0.161,231.1,49.95,OK
2025-01-13T12:45:00,SITE_RES_001,0.174,227.8,49.99,OK
2025-01-26T17:30:00,SITE_COM_001,1.163,225.8,50.03,OK
2025-01-30T20:00:00,SITE_IND_002,2.532,229.7,49.68,OK
14/01/2025 05:45:00,SITE_COM_001,0.192,229.3,49.98,OK
09/01/2025 10:15:00,SITE_COM_001,1.083,210.9,49.96,OK
01/01/2025 02:00:00,SITE_COM_001,0.208,233.5,49.86,OK
22/01/2025 19:45:00,SITE_COM_001,1.261,237.4,50.2,OK
2025-01-13T06:30:00,SITE_RES_002,0.122,235.9,50.14,OK
2025-01-12T12:15:00,SITE_COM_001,1.241,228.7,50.21,OK
12/01/2025 19:30:00,SITE_RES_001,0.458,253.4,50.17,OK
2025-01-08T00:30:00,SITE_COM_001,0.173,239.9,49.77,OK
2025-01-21T21:30:00,SITE_RES_002,0.135,217.4,50.16,OK
2025-01-01T17:00:00,SITE_COM_001,1.1,216.3,49.98,OK
2025-01-28T12:00:00,SITE_IND_002,2.747,223.5,50.06,OK
23/01/2025 20:30:00,SITE_IND_002,1.882,245.1,49.77,OK
11/01/2025 07:30:00,SITE_RES_002,0.313,234.5,50.06,OK
2025-01-11 16:15:00,SITE_IND_002,1.278,226.8,50.1,OK
2025-01-22 14:00:00,SITE_IND_001,10.557,239.3,50.0,OK
2025-01-19T21:15:00,SITE_COM_002,0.125,253.9,49.82,OK
2025-01-08T16:00:00,SITE_IND_002,2.486,220.9,49.92,OK
2025-01-25T21:30:00,SITE_COM_002,0.139,250.2,50.36,OK
2025-01-14 06:30:00,SITE_RES_001,0.178,241.9,49.97,OK
01/01/2025 05:30:00,SITE_RES_002,,214.7,50.26,ERROR
2025-01-14 09:45:00,SITE_IND_002,,242.6,50.16,ERROR
2025-01-04T12:00:00,SITE_RES_002,,231.8,49.95,ERROR
13/01/2025 19:45:00,SITE_RES_002,0.3,217.6,49.93,OK
2025-01-02T12:30:00,SITE_COM_001,1.506,240.7,50.04,OK
2025-01-19T12:00:00,SITE_IND_002,,214.4,50.03,ERROR
2025-01-02T21:30:00,SITE_RES_002,0.075,242.8,50.07,OK
2025-01-15 12:00:00,SITE_COM_002,0.753,242.1,49.92,OK
26/01/2025 23:15:00,SITE_COM_002,0.16,238.4,49.78,OK
09/01/2025 21:45:00,SITE_RES_002,,229.0,50.0,ERROR
2025-01-30T17:00:00,SITE_COM_002,1.015,217.9,49.85,OK
2025-01-09T20:45:00,SITE_IND_001,,229.5,50.13,ERROR
2025-01-20T08:00:00,SITE_IND_001,3.864,224.7,50.32,OK
25/01/2025 11:30:00,SITE_COM_002,0.957,229.8,50.15,OK
2025-01-12T10:15:00,SITE_COM_001,1.209,241.6,49.86,OK
13/01/2025 15:30:00,SITE_RES_002,0.116,205.8,50.02,OK
15/01/2025 07:15:00,SITE_RES_001,0.331,227.3,50.05,OK
18/01/2025 08:30:00,SITE_COM_001,0.973,224.2,50.29,OK
2025-01-18 18:00:00,SITE_RES_001,0.404,239.3,50.01,OK
2025-01-22T01:30:00,SITE_COM_001,0.221,223.6,49.98,OK
2025-01-18T15:00:00,SITE_COM_001,-888.0,238.4,49.99,ERROR
2025-01-26 00:30:00,SITE_IND_002,0.803,221.2,49.97,OK
2025-01-21T10:30:00,SITE_COM_002,1.135,229.4,50.03,OK
28/01/2025 06:00:00,SITE_COM_001,0.181,227.5,50.01,OK
2025-01-02 19:00:00,SITE_COM_002,0.949,217.1,50.11,OK
2025-01-24T02:15:00,SITE_RES_002,0.138,239.2,50.28,OK
10/01/2025 06:45:00,SITE_COM_001,0.201,236.6,49.82,OK
2025-01-01T17:45:00,SITE_RES_002,0.135,230.8,49.98,OK
01/01/2025 20:00:00,SITE_RES_002,0.221,237.5,50.08,OK
2025-01-08T00:15:00,SITE_RES_002,0.111,249.6,50.06,OK
2025-01-15T22:15:00,SITE_RES_001,1.422,238.1,49.97,OK
2025-01-13T23:15:00,SITE_RES_001,-888.0,229.3,49.79,ERROR
22/01/2025 22:15:00,SITE_RES_001,-999.0,229.3,50.12,ERROR
10/01/2025 00:45:00,SITE_RES_002,0.107,228.9,50.01,OK
21/01/2025 15:00:00,SITE_IND_002,2.326,217.9,50.07,OK
2025-01-20 11:15:00,SITE_COM_001,1.001,227.2,50.0,OK
2025-01-17T16:30:00,SITE_RES_001,0.128,230.7,49.97,OK
2025-01-04 16:15:00,SITE_IND_002,0.807,210.2,49.7,OK
2025-01-27T06:00:00,SITE_COM_001,0.23,236.1,50.15,OK
14/01/2025 19:00:00,SITE_COM_001,1.29,219.9,49.89,OK
2025-01-15T02:15:00,SITE_COM_002,0.17,241.6,50.17,OK
2025-01-03T17:45:00,SITE_COM_001,1.293,235.0,50.0,OK
11/01/2025 18:30:00,SITE_RES_002,0.344,222.7,49.82,OK
2025-01-07 03:45:00,SITE_IND_002,0.955,240.7,49.96,OK
22/01/2025 04:15:00,SITE_RES_001,0.184,233.7,50.12,OK
2025-01-11T05:45:00,SITE_RES_002,0.131,244.6,50.14,OK
2025-01-02T12:45:00,SITE_COM_001,1.292,240.3,49.87,OK
02/01/2025 19:15:00,SITE_IND_002,2.172,240.5,50.33,OK
2025-01-07T01:45:00,SITE_COM_002,,230.2,50.15,ERROR
21/01/2025 03:15:00,SITE_COM_001,0.2,245.8,50.14,OK
2025-01-06 03:30:00,SITE_RES_001,0.15,222.3,50.15,OK
20/01/2025 01:30:00,SITE_COM_001,0.179,238.9,50.03,OK
11/01/2025 01:00:00,SITE_COM_001,0.221,219.4,49.8,OK
2025-01-14 05:15:00,SITE_IND_001,1.862,238.1,50.32,OK
2025-01-18 21:15:00,SITE_COM_002,,221.7,50.23,ERROR
2025-01-27T04:30:00,SITE_IND_002,1.12,221.1,49.81,OK
24/01/2025 05:15:00,SITE_COM_002,0.154,241.9,49.8,OK
2025-01-01 01:45:00,SITE_RES_002,0.144,213.9,50.04,OK
2025-01-29 18:30:00,SITE_COM_002,0.896,229.6,49.86,OK
2025-01-04T15:15:00,SITE_RES_002,0.1,226.5,49.88,OK
2025-01-15T02:00:00,SITE_COM_002,0.16,220.2,50.04,OK
2025-01-28T08:00:00,SITE_RES_001,0.273,225.7,49.86,OK
2025-01-02T18:00:00,SITE_COM_001,0.752,223.4,50.09,OK
2025-01-30T20:45:00,SITE_IND_002,1.549,223.3,50.04,OK
07/01/2025 23:45:00,SITE_COM_001,0.176,245.6,50.16,OK
2025-01-08T00:00:00,SITE_IND_001,1.803,224.0,50.14,OK
10/01/2025 09:45:00,SITE_COM_002,0.889,235.7,50.19,OK
13/01/2025 05:00:00,SITE_COM_002,,242.2,49.76,ERROR
2025-01-09T10:45:00,SITE_RES_001,0.213,231.3,50.2,OK
29/01/2025 07:30:00,SITE_COM_001,0.234,220.8,49.71,OK
04/01/2025 12:15:00,SITE_RES_001,0.128,243.4,50.31,OK
2025-01-02 13:30:00,SITE_IND_001,3.703,240.9,50.4,OK
02/01/2025 14:45:00,SITE_RES_001,1.308,220.0,49.98,OK
2025-01-14T21:45:00,SITE_IND_002,1.656,230.9,50.03,OK
2025-01-22 19:45:00,SITE_RES_001,0.407,219.1,49.87,OK
17/01/2025 19:15:00,SITE_COM_002,0.929,222.2,49.78,OK
2025-01-11 01:45:00,SITE_COM_001,0.16,219.6,49.89,OK
11/01/2025 01:30:00,SITE_RES_001,0.175,228.1,50.27,OK
05/01/2025 05:00:00,SITE_IND_002,0.939,219.5,49.99,OK
05/01/2025 06:00:00,SITE_IND_001,1.398,219.8,49.84,OK
2025-01-18T01:45:00,SITE_RES_001,0.173,217.5,50.02,OK
2025-01-05T21:15:00,SITE_IND_001,1.447,216.9,50.04,OK
2025-01-04T10:30:00,SITE_RES_001,0.143,238.1,50.11,OK
2025-01-29T23:45:00,SITE_IND_002,1.13,221.7,50.35,OK
12/01/2025 04:15:00,SITE_IND_001,1.635,229.8,49.89,OK
2025-01-02 15:45:00,SITE_RES_002,0.108,232.9,49.96,OK
30/01/2025 08:45:00,SITE_RES_002,0.242,240.7,49.91,OK
2025-01-05T07:15:00,SITE_RES_002,0.289,225.4,50.1,OK
27/01/2025 06:45:00,SITE_IND_002,2.251,246.0,50.07,OK
01/01/2025 00:00:00,SITE_COM_002,0.162,225.4,49.91,OK
2025-01-22T21:45:00,SITE_RES_001,0.175,220.5,49.95,OK
2025-01-28T21:15:00,SITE_COM_002,0.204,246.6,50.49,OK
2025-01-25T06:45:00,SITE_IND_002,1.246,232.3,50.01,OK
2025-01-23T19:15:00,SITE_RES_001,0.3,242.0,50.1,OK
25/01/2025 01:00:00,SITE_COM_001,0.197,243.2,50.23,OK
2025-01-27 01:00:00,SITE_COM_001,0.141,213.5,50.5,OK
21/01/2025 13:30:00,SITE_IND_002,2.37,238.5,49.74,OK
2025-01-20 05:00:00,SITE_COM_001,0.234,233.7,50.29,OK
06/01/2025 02:15:00,SITE_COM_002,0.157,230.8,50.14,OK
2025-01-18 12:30:00,SITE_RES_002,0.125,241.6,49.94,OK
17/01/2025 16:15:00,SITE_RES_001,0.19,218.5,50.15,OK
17/01/2025 02:30:00,SITE_COM_002,0.09,236.4,50.25,OK
2025-01-20T02:15:00,SITE_IND_002,0.958,239.0,49.81,OK
14/01/2025 12:45:00,SITE_IND_001,3.925,215.0,50.22,OK
2025-01-17T20:45:00,SITE_RES_002,0.345,233.9,49.98,OK
29/01/2025 00:00:00,SITE_IND_001,1.878,234.0,49.84,OK
2025-01-07T20:00:00,SITE_COM_001,0.219,237.0,50.18,OK
2025-01-11T18:00:00,SITE_COM_001,1.087,228.0,50.27,OK
2025-01-08 16:45:00,SITE_RES_001,0.176,232.9,50.47,OK
2025-01-08T22:00:00,SITE_RES_001,0.203,224.5,49.83,OK
2025-01-16 14:45:00,SITE_RES_002,0.106,231.2,49.88,OK
2025-01-08T10:15:00,SITE_COM_002,0.875,251.6,50.01,OK
23/01/2025 19:30:00,SITE_COM_002,,215.0,49.91,ERROR
2025-01-14T00:15:00,SITE_IND_002,0.891,209.8,50.06,OK
2025-01-03 13:15:00,SITE_IND_001,3.149,229.4,49.79,OK
2025-01-10T19:30:00,SITE_RES_002,0.291,233.2,49.8,OK
2025-01-17 11:45:00,SITE_IND_001,3.092,218.3,49.67,OK
2025-01-06T06:45:00,SITE_RES_002,0.117,232.5,49.92,OK
2025-01-19T08:00:00,SITE_IND_001,1.668,213.2,49.99,OK
2025-01-11T11:45:00,SITE_COM_002,0.703,222.9,50.01,OK
19/01/2025 12:15:00,SITE_IND_001,1.541,222.1,50.09,OK
28/01/2025 22:00:00,SITE_COM_002,0.186,225.7,50.44,OK
2025-01-13T23:30:00,SITE_COM_002,0.149,247.6,50.01,OK
2025-01-12T09:15:00,SITE_COM_002,1.103,215.2,50.04,OK
2025-01-03T17:15:00,SITE_RES_001,0.145,235.9,50.08,OK
2025-01-17T23:30:00,SITE_RES_002,0.09,226.5,50.16,OK
2025-01-08 01:00:00,SITE_COM_001,0.142,226.7,49.6,OK
30/01/2025 22:45:00,SITE_RES_002,0.08,240.0,50.18,OK
2025-01-18T12:00:00,SITE_COM_002,3.11,214.7,50.09,OK
2025-01-06 01:45:00,SITE_IND_002,1.173,226.2,50.31,OK
2025-01-15T22:45:00,SITE_RES_001,0.2,245.0,50.15,OK
02/01/2025 20:00:00,SITE_IND_001,3.449,225.8,49.81,OK
2025-01-19 19:30:00,SITE_COM_001,1.23,236.8,50.09,OK
2025-01-24T23:30:00,SITE_COM_002,0.161,226.1,49.7,OK
2025-01-01T14:15:00,SITE_RES_001,0.165,240.5,50.34,OK
2025-01-11 04:15:00,SITE_COM_001,0.209,233.3,49.55,OK
2025-01-28T06:00:00,SITE_RES_001,0.132,220.9,50.25,OK
2025-01-21 06:30:00,SITE_COM_002,0.132,225.1,49.95,OK
2025-01-29T01:30:00,SITE_RES_001,-888.0,231.5,49.9,ERROR
2025-01-29T18:00:00,SITE_RES_001,0.369,221.7,49.8,OK
04/01/2025 21:45:00,SITE_COM_001,0.21,234.9,50.41,OK
2025-01-07T16:00:00,SITE_RES_001,0.145,214.3,50.19,OK
29/01/2025 22:45:00,SITE_COM_001,0.212,210.4,49.86,OK
2025-01-22T07:00:00,SITE_COM_001,0.238,244.9,49.85,OK
15/01/2025 14:00:00,SITE_COM_002,0.94,232.3,49.92,OK
30/01/2025 23:45:00,SITE_COM_002,0.197,230.7,49.95,OK
2025-01-07T03:45:00,SITE_RES_001,0.155,232.3,49.92,OK
2025-01-22T12:00:00,SITE_IND_002,2.269,218.7,49.94,OK
2025-01-25T07:45:00,SITE_IND_001,1.605,222.8,50.04,OK
2025-01-26 11:30:00,SITE_RES_002,0.113,245.9,49.78,OK
2025-01-24 08:00:00,SITE_IND_002,2.53,234.3,49.91,OK
2025-01-27T23:00:00,SITE_COM_001,0.217,212.2,50.1,OK
2025-01-28T00:00:00,SITE_RES_001,0.18,235.6,50.23,OK
2025-01-01 04:15:00,SITE_IND_001,1.787,224.1,50.11,OK
2025-01-25T15:30:00,SITE_IND_002,1.183,245.3,49.87,OK
2025-01-12 15:00:00,SITE_RES_001,0.114,222.1,50.31,OK
2025-01-17 17:00:00,SITE_RES_001,0.157,217.8,49.79,OK
27/01/2025 18:30:00,SITE_RES_001,0.387,230.7,50.03,OK
2025-01-11T12:00:00,SITE_RES_002,,247.5,49.89,ERROR
2025-01-07 00:30:00,SITE_IND_001,1.405,240.5,50.02,OK
12/01/2025 14:45:00,SITE_COM_001,1.439,226.7,49.95,OK
25/01/2025 06:15:00,SITE_RES_001,0.156,223.4,49.85,OK
2025-01-28T01:30:00,SITE_IND_002,1.114,234.1,49.66,OK
2025-01-02 20:15:00,SITE_COM_002,0.108,237.1,49.62,OK
2025-01-03 23:00:00,SITE_IND_001,1.491,216.0,49.97,OK
2025-01-05T04:00:00,SITE_RES_002,0.13,224.1,50.31,OK
2025-01-21T05:30:00,SITE_RES_001,0.147,226.5,49.61,OK
2025-01-03T23:15:00,SITE_COM_001,0.214,237.3,49.86,OK
09/01/2025 17:15:00,SITE_IND_001,3.849,237.7,49.93,OK
2025-01-10T00:30:00,SITE_COM_002,0.096,240.6,49.7,OK
2025-01-09T13:30:00,SITE_RES_001,0.142,225.9,49.86,OK
27/01/2025 04:45:00,SITE_IND_002,1.037,247.0,50.01,OK
2025-01-22T06:00:00,SITE_IND_002,1.846,226.5,50.08,OK
2025-01-14T13:15:00,SITE_COM_002,0.912,232.4,50.14,OK
2025-01-19 22:45:00,SITE_IND_002,0.966,245.4,50.23,OK
01/01/2025 01:15:00,SITE_RES_001,0.152,222.0,49.97,OK
2025-01-30 20:00:00,SITE_COM_001,0.157,219.3,49.65,OK
2025-01-29T01:30:00,SITE_COM_001,0.206,234.3,49.83,OK
2025-01-30 15:15:00,SITE_IND_002,2.532,232.0,50.07,OK
23/01/2025 14:45:00,SITE_COM_001,1.482,221.7,49.99,OK
2025-01-06T13:30:00,SITE_COM_002,0.831,231.8,50.18,OK
2025-01-15 16:45:00,SITE_RES_001,0.189,235.0,49.79,OK
2025-01-15 19:30:00,SITE_RES_002,0.255,233.6,50.02,OK
02/01/2025 15:00:00,SITE_IND_002,2.216,247.4,49.94,OK
01/01/2025 16:30:00,SITE_IND_001,3.789,220.3,50.02,OK
21/01/2025 10:00:00,SITE_RES_002,0.138,220.9,50.29,OK
28/01/2025 11:00:00,SITE_IND_001,4.086,237.5,50.02,OK
2025-01-03T10:45:00,SITE_IND_002,2.635,214.4,49.76,OK
2025-01-09T02:45:00,SITE_RES_002,0.113,238.5,50.11,OK
23/01/2025 09:15:00,SITE_RES_001,-888.0,235.2,49.78,ERROR
2025-01-24 15:15:00,SITE_COM_001,1.372,206.5,50.13,OK
2025-01-15T06:00:00,SITE_COM_002,0.156,224.5,49.69,OK
2025-01-26T22:30:00,SITE_COM_002,0.166,219.6,49.87,OK
2025-01-06T12:45:00,SITE_COM_002,0.97,251.6,49.92,OK
2025-01-16T05:15:00,SITE_COM_002,0.171,239.0,50.25,OK
2025-01-27T03:00:00,SITE_COM_001,0.243,224.5,49.79,OK
2025-01-12T13:45:00,SITE_COM_002,,227.7,50.43,ERROR
24/01/2025 03:00:00,SITE_COM_001,0.257,221.0,50.12,OK
2025-01-20T14:15:00,SITE_RES_001,0.171,213.3,49.94,OK
2025-01-09T21:45:00,SITE_COM_002,0.134,231.3,50.15,OK
03/01/2025 02:15:00,SITE_RES_001,0.174,223.7,49.95,OK
04/01/2025 01:30:00,SITE_RES_001,0.154,240.8,49.97,OK
2025-01-05T11:15:00,SITE_RES_002,0.129,232.1,50.12,OK
03/01/2025 20:00:00,SITE_IND_001,2.614,218.8,50.13,OK
2025-01-02T21:00:00,SITE_RES_002,1.739,221.2,49.86,OK
2025-01-25T17:00:00,SITE_IND_002,1.238,215.5,50.26,OK
2025-01-30T19:45:00,SITE_COM_002,0.797,232.1,49.78,OK
17/01/2025 07:00:00,SITE_IND_001,3.903,223.9,49.98,OK
2025-01-13 00:30:00,SITE_COM_002,0.139,225.7,50.11,OK
2025-01-03T16:45:00,SITE_COM_002,0.68,234.8,49.79,OK
24/01/2025 12:30:00,SITE_COM_002,0.783,222.5,50.16,OK
2025-01-22 12:15:00,SITE_IND_001,4.26,222.3,49.8,OK
2025-01-20T12:30:00,SITE_COM_002,1.012,210.9,49.87,OK
29/01/2025 21:15:00,SITE_RES_002,0.126,228.9,50.02,OK
2025-01-20 03:45:00,SITE_RES_002,0.111,239.1,50.23,OK
2025-01-12T06:45:00,SITE_COM_002,0.167,218.6,49.92,OK
17/01/2025 23:00:00,SITE_COM_002,0.151,232.8,49.98,OK
2025-01-30T05:00:00,SITE_RES_002,0.143,226.5,50.18,OK
2025-01-14T12:30:00,SITE_COM_001,1.44,226.5,50.13,OK
2025-01-10T00:15:00,SITE_RES_001,0.163,215.2,49.73,OK
2025-01-22 15:45:00,SITE_COM_001,1.146,223.5,50.05,OK
03/01/2025 06:45:00,SITE_RES_001,0.146,223.9,49.98,OK
2025-01-15T17:45:00,SITE_COM_001,1.428,216.1,49.8,OK
2025-01-16T00:15:00,SITE_RES_001,0.133,230.2,49.63,OK
2025-01-22T13:15:00,SITE_IND_001,3.562,217.6,50.17,OK
2025-01-30T10:15:00,SITE_COM_002,0.918,232.3,49.72,OK
21/01/2025 06:45:00,SITE_COM_002,0.145,250.8,50.05,OK
22/01/2025 17:45:00,SITE_IND_001,4.491,222.3,50.05,OK
2025-01-28 00:45:00,SITE_RES_002,0.1,218.8,50.31,OK
2025-01-22T18:45:00,SITE_RES_001,0.332,224.9,50.18,OK
25/01/2025 07:00:00,SITE_COM_002,0.185,224.0,49.98,OK
2025-01-06 07:00:00,SITE_COM_001,0.22,232.3,50.2,OK
2025-01-01T05:15:00,SITE_RES_001,0.138,234.9,49.74,OK
2025-01-10T12:00:00,SITE_COM_001,0.929,239.1,50.02,OK
2025-01-21T06:30:00,SITE_IND_002,2.296,210.7,49.76,OK
2025-01-10T14:15:00,SITE_COM_001,0.981,204.6,49.84,OK
21/01/2025 14:45:00,SITE_IND_002,2.155,240.5,50.04,OK
2025-01-07T05:45:00,SITE_RES_002,0.111,230.4,50.24,OK
04/01/2025 14:45:00,SITE_COM_002,0.602,243.9,49.73,OK
2025-01-22T18:15:00,SITE_COM_002,0.886,230.3,50.0,OK
24/01/2025 02:45:00,SITE_RES_001,0.101,238.9,50.33,OK
2025-01-14T15:00:00,SITE_RES_001,2.051,229.9,49.95,OK
08/01/2025 15:15:00,SITE_COM_002,0.914,237.5,49.74,OK
09/01/2025 11:15:00,SITE_COM_001,1.568,232.3,49.6,OK
2025-01-16T22:30:00,SITE_COM_002,0.122,218.7,49.92,OK
26/01/2025 21:00:00,SITE_RES_002,0.08,222.3,50.16,OK
2025-01-29 19:15:00,SITE_COM_001,1.264,236.2,49.99,OK
2025-01-09 19:45:00,SITE_IND_002,2.183,233.6,50.07,OK
2025-01-17T13:00:00,SITE_COM_001,1.283,226.6,49.81,OK
2025-01-11T21:15:00,SITE_RES_002,0.103,238.9,49.95,OK
2025-01-05T23:45:00,SITE_RES_001,0.133,218.3,50.25,OK
2025-01-05T20:30:00,SITE_IND_002,1.032,245.7,49.93,OK
2025-01-12T20:00:00,SITE_RES_001,0.412,208.6,50.09,OK
2025-01-13 01:30:00,SITE_COM_002,0.182,227.5,49.87,OK
2025-01-30 17:45:00,SITE_RES_001,0.166,224.0,50.35,OK
2025-01-15T14:15:00,SITE_RES_001,0.187,229.8,49.85,OK
2025-01-20T12:00:00,SITE_IND_002,,239.5,50.22,ERROR
2025-01-28 00:30:00,SITE_RES_001,0.117,239.4,49.93,OK
2025-01-25T23:15:00,SITE_COM_002,0.21,227.1,50.07,OK
2025-01-14T10:15:00,SITE_IND_002,2.176,244.0,50.59,OK
2025-01-12T17:15:00,SITE_COM_002,,231.5,50.28,ERROR
2025-01-15 23:00:00,SITE_COM_001,0.159,228.2,49.96,OK
2025-01-09 23:45:00,SITE_RES_001,0.157,229.9,49.82,OK
12/01/2025 19:45:00,SITE_COM_001,1.097,217.2,50.06,OK
21/01/2025 01:30:00,SITE_IND_002,1.213,220.3,49.83,OK
2025-01-02 03:15:00,SITE_IND_002,1.064,228.0,49.97,OK
2025-01-14T13:15:00,SITE_COM_001,1.259,232.0,50.36,OK
2025-01-28 07:00:00,SITE_RES_002,0.289,217.4,50.04,OK
2025-01-07T06:45:00,SITE_RES_002,0.131,243.0,50.06,OK
2025-01-20T21:00:00,SITE_IND_002,2.776,237.2,49.83,OK
11/01/2025 09:45:00,SITE_RES_002,0.134,218.5,50.21,OK
2025-01-10T06:45:00,SITE_COM_002,0.12,236.7,49.7,OK
2025-01-06T15:15:00,SITE_RES_002,0.126,225.4,50.21,OK
2025-01-18 16:30:00,SITE_IND_002,0.834,235.5,50.67,OK
03/01/2025 00:45:00,SITE_RES_002,0.099,228.0,50.41,OK
2025-01-30T12:15:00,SITE_IND_001,4.136,226.3,50.0,OK
2025-01-19T16:15:00,SITE_COM_001,1.395,218.0,49.63,OK
2025-01-11T17:15:00,SITE_COM_002,,242.9,49.76,ERROR
28/01/2025 04:15:00,SITE_IND_002,0.838,229.4,49.71,OK
2025-01-20T23:15:00,SITE_IND_002,1.039,234.5,50.32,OK
2025-01-01T18:30:00,SITE_RES_002,0.342,216.3,49.96,OK
2025-01-22T01:45:00,SITE_RES_002,0.126,231.1,50.57,OK
2025-01-03T12:30:00,SITE_RES_001,0.144,232.2,49.65,OK
23/01/2025 03:00:00,SITE_IND_001,1.527,241.3,50.06,OK
2025-01-30T22:30:00,SITE_IND_001,1.481,232.0,49.68,OK
2025-01-16T23:00:00,SITE_IND_001,1.291,229.0,49.88,OK
2025-01-27 01:30:00,SITE_IND_002,-999.0,222.9,49.8,ERROR
22/01/2025 13:00:00,SITE_IND_001,3.297,230.3,49.99,OK
2025-01-04T04:30:00,SITE_COM_001,,214.8,50.1,ERROR
2025-01-01T22:15:00,SITE_IND_002,0.9,231.2,50.32,OK
2025-01-20T03:15:00,SITE_RES_002,0.154,220.5,49.94,OK
28/01/2025 01:00:00,SITE_COM_002,0.12,229.7,50.24,OK
17/01/2025 01:45:00,SITE_RES_002,0.15,257.6,50.09,OK
2025-01-09T23:45:00,SITE_RES_002,0.116,212.4,50.06,OK
2025-01-22T09:45:00,SITE_IND_002,2.366,245.4,50.02,OK
18/01/2025 07:30:00,SITE_IND_001,1.528,237.4,49.68,OK
2025-01-08T04:00:00,SITE_IND_001,1.411,229.2,49.93,OK
2025-01-06T02:00:00,SITE_IND_002,1.003,236.8,49.86,OK
30/01/2025 06:00:00,SITE_IND_001,3.36,242.9,49.9,OK
12/01/2025 07:15:00,SITE_IND_001,1.403,213.4,50.3,OK
04/01/2025 21:45:00,SITE_IND_001,1.701,222.3,49.95,OK
23/01/2025 23:45:00,SITE_RES_002,,221.5,49.89,ERROR
13/01/2025 08:15:00,SITE_COM_002,1.129,227.5,50.27,OK
26/01/2025 05:00:00,SITE_COM_002,0.18,236.0,49.94,OK
2025-01-27T02:30:00,SITE_COM_001,,248.0,49.97,ERROR
08/01/2025 23:45:00,SITE_IND_001,1.319,220.8,50.32,OK
2025-01-15T12:00:00,SITE_IND_001,2.872,225.4,50.16,OK
2025-01-23T03:30:00,SITE_RES_002,0.121,226.7,50.26,OK
12/01/2025 10:00:00,SITE_RES_001,0.156,233.9,49.8,OK
2025-01-24 14:00:00,SITE_RES_002,0.119,229.5,49.78,OK
2025-01-27T02:15:00,SITE_IND_002,1.113,225.3,49.99,OK
2025-01-07T20:15:00,SITE_IND_001,7.54,230.0,49.84,OK
2025-01-18T05:30:00,SITE_RES_002,0.126,212.0,49.52,OK
2025-01-06T02:00:00,SITE_RES_001,0.148,239.0,50.25,OK
2025-01-17 14:30:00,SITE_IND_002,1.826,230.6,49.93,OK
2025-01-21T10:45:00,SITE_IND_001,3.21,227.0,49.89,OK
16/01/2025 01:15:00,SITE_IND_001,1.726,232.4,50.26,OK
19/01/2025 17:45:00,SITE_COM_001,1.024,232.4,50.08,OK
2025-01-09T04:00:00,SITE_COM_001,0.176,221.3,49.46,OK
2025-01-29 20:00:00,SITE_COM_002,0.136,235.6,49.67,OK
2025-01-01T08:00:00,SITE_RES_001,0.45,221.4,50.01,OK
2025-01-01T21:30:00,SITE_COM_001,0.193,233.7,50.18,OK
14/01/2025 21:30:00,SITE_RES_001,0.138,247.0,50.03,OK
2025-01-17 09:45:00,SITE_COM_001,1.26,219.4,50.15,OK
2025-01-04T21:15:00,SITE_IND_001,1.058,234.6,50.21,OK
2025-01-09T07:15:00,SITE_COM_002,0.192,230.4,50.06,OK
2025-01-01T16:30:00,SITE_RES_002,0.13,230.5,50.01,OK
28/01/2025 14:15:00,SITE_RES_002,0.136,245.9,49.99,OK
2025-01-02T21:30:00,SITE_RES_002,0.075,242.8,50.07,OK
23/01/2025 14:15:00,SITE_RES_001,0.143,214.1,50.04,OK
01/01/2025 02:15:00,SITE_COM_002,4.088,229.2,50.07,OK
2025-01-09 11:30:00,SITE_IND_001,,215.9,49.35,ERROR
2025-01-08 01:45:00,SITE_IND_001,1.712,234.5,49.88,OK
2025-01-28T19:30:00,SITE_IND_001,3.441,225.7,50.18,OK
2025-01-17T06:00:00,SITE_IND_002,1.882,252.5,50.25,OK
2025-01-13T10:15:00,SITE_RES_002,0.09,224.9,50.27,OK
2025-01-21 03:00:00,SITE_IND_001,1.588,234.4,50.31,OK
27/01/2025 23:15:00,SITE_COM_002,0.137,204.4,49.87,OK
10/01/2025 12:30:00,SITE_RES_002,0.092,227.3,50.05,OK
2025-01-26T12:30:00,SITE_IND_001,1.319,226.3,50.08,OK
29/01/2025 01:00:00,SITE_RES_001,0.172,230.9,50.2,OK
2025-01-05T14:15:00,SITE_IND_002,1.095,215.6,50.09,OK
14/01/2025 12:00:00,SITE_RES_001,0.169,229.0,50.19,OK
09/01/2025 12:00:00,SITE_COM_002,3.167,241.0,49.71,OK
18/01/2025 01:15:00,SITE_RES_002,0.116,220.8,49.76,OK
2025-01-14 17:00:00,SITE_RES_001,0.204,222.8,49.97,OK
2025-01-12T14:00:00,SITE_IND_001,1.199,214.8,49.81,OK
01/01/2025 04:00:00,SITE_COM_002,0.157,238.1,50.13,OK
03/01/2025 22:30:00,SITE_COM_001,0.203,219.3,50.19,OK
2025-01-23T17:45:00,SITE_COM_002,0.693,232.8,49.84,OK
2025-01-27T17:45:00,SITE_COM_001,4.607,218.8,50.01,OK
2025-01-12 14:00:00,SITE_RES_002,0.141,216.9,50.09,OK
14/01/2025 13:15:00,SITE_IND_001,3.314,224.6,50.4,OK
2025-01-04T18:30:00,SITE_COM_001,1.134,238.1,50.22,OK
2025-01-16T01:15:00,SITE_RES_001,0.191,227.6,50.26,OK
06/01/2025 17:45:00,SITE_RES_001,0.143,221.5,50.13,OK
2025-01-18T00:30:00,SITE_RES_001,0.143,233.0,49.89,OK
03/01/2025 23:00:00,SITE_COM_002,0.14,227.4,49.99,OK
2025-01-01T10:30:00,SITE_COM_001,1.661,229.0,50.23,OK
10/01/2025 23:15:00,SITE_IND_001,1.171,232.4,49.97,OK
03/01/2025 06:15:00,SITE_IND_001,4.196,215.9,50.12,OK
21/01/2025 12:15:00,SITE_COM_001,0.988,229.4,50.22,OK
2025-01-21T22:15:00,SITE_IND_001,1.557,234.2,49.8,OK
2025-01-12T06:15:00,SITE_COM_002,0.171,242.0,50.11,OK
2025-01-01T20:00:00,SITE_COM_002,0.15,233.1,50.34,OK
2025-01-04 11:15:00,SITE_RES_001,0.152,214.1,50.23,OK
2025-01-27T05:30:00,SITE_COM_002,0.148,218.9,50.0,OK
19/01/2025 02:45:00,SITE_IND_001,1.489,244.5,49.36,OK
22/01/2025 15:00:00,SITE_RES_001,0.17,213.8,49.93,OK
09/01/2025 21:45:00,SITE_RES_002,,229.0,50.0,ERROR
2025-01-26 15:45:00,SITE_RES_002,,237.5,50.18,ERROR
20/01/2025 15:15:00,SITE_RES_002,0.11,239.9,49.9,OK
2025-01-14 08:45:00,SITE_RES_001,0.425,218.1,49.9,OK
2025-01-20T09:45:00,SITE_IND_001,4.043,232.4,50.09,OK
2025-01-07T12:15:00,SITE_COM_001,0.709,230.1,49.91,OK
21/01/2025 22:45:00,SITE_RES_002,0.111,222.9,50.4,OK
2025-01-04T17:45:00,SITE_COM_002,0.858,231.3,49.52,OK
20/01/2025 23:00:00,SITE_IND_001,1.07,234.5,50.07,OK
26/01/2025 04:15:00,SITE_RES_002,0.1,227.8,49.64,OK
2025-01-13T09:45:00,SITE_COM_002,0.876,233.0,49.94,OK
2025-01-08T02:30:00,SITE_RES_002,0.097,241.3,50.32,OK
09/01/2025 09:15:00,SITE_COM_001,1.083,253.2,50.12,OK
2025-01-02T14:30:00,SITE_COM_002,0.812,218.0,49.79,OK
2025-01-19T04:30:00,SITE_IND_002,1.162,235.1,49.91,OK
2025-01-28 18:30:00,SITE_IND_001,2.295,225.4,49.73,OK
2025-01-11T12:30:00,SITE_COM_001,-777.0,232.7,49.9,ERROR
2025-01-09T17:45:00,SITE_IND_001,3.982,214.8,50.12,OK
2025-01-12T15:15:00,SITE_RES_001,0.172,216.8,49.83,OK
2025-01-09T00:30:00,SITE_COM_001,0.222,232.9,50.13,OK
14/01/2025 13:15:00,SITE_IND_002,3.005,222.4,50.03,OK
2025-01-14T10:00:00,SITE_COM_002,0.909,222.2,49.79,OK
22/01/2025 15:15:00,SITE_RES_002,0.139,238.2,49.84,OK
09/01/2025 10:00:00,SITE_RES_001,0.12,243.2,49.81,OK
2025-01-08T08:45:00,SITE_COM_002,0.875,222.3,49.87,OK
2025-01-09 22:30:00,SITE_IND_002,-777.0,239.4,50.22,ERROR
2025-01-16T02:15:00,SITE_RES_001,0.187,241.1,50.02,OK
2025-01-04 02:15:00,SITE_IND_002,1.055,236.1,50.08,OK
07/01/2025 07:15:00,SITE_RES_002,0.223,221.7,50.07,OK
2025-01-14T09:45:00,SITE_COM_002,0.825,232.5,49.92,OK
2025-01-19T16:30:00,SITE_IND_001,1.365,238.5,49.75,OK
2025-01-27T05:00:00,SITE_RES_002,0.111,236.6,50.2,OK
2025-01-11 06:45:00,SITE_RES_002,0.106,216.1,50.23,OK
14/01/2025 11:00:00,SITE_IND_001,3.936,220.5,49.84,OK
2025-01-05 10:15:00,SITE_RES_001,0.144,236.6,50.18,OK
2025-01-12T23:30:00,SITE_RES_001,0.143,235.6,49.97,OK
02/01/2025 18:30:00,SITE_COM_002,0.994,217.3,50.34,OK
2025-01-20 00:30:00,SITE_RES_001,-777.0,235.7,49.61,ERROR
15/01/2025 05:00:00,SITE_COM_002,0.142,245.7,50.13,OK
2025-01-18 15:15:00,SITE_RES_001,0.18,234.7,50.07,OK
11/01/2025 23:30:00,SITE_IND_002,0.941,232.3,50.27,OK
2025-01-06 15:00:00,SITE_RES_002,0.117,234.2,49.9,OK
2025-01-26T17:30:00,SITE_RES_002,0.139,244.9,50.05,OK
14/01/2025 11:15:00,SITE_COM_001,,227.6,50.24,ERROR
01/01/2025 17:00:00,SITE_IND_002,2.396,239.6,50.44,OK
2025-01-03 01:45:00,SITE_RES_002,0.138,233.4,49.95,OK
2025-01-10T01:45:00,SITE_RES_001,0.179,216.0,49.95,OK
25/01/2025 18:30:00,SITE_COM_002,1.218,234.8,49.94,OK
2025-01-04T22:45:00,SITE_IND_002,0.956,215.0,50.0,OK
2025-01-05T11:00:00,SITE_COM_002,0.945,243.0,50.13,OK
2025-01-28T02:30:00,SITE_RES_001,0.155,238.4,50.13,OK
2025-01-22T18:00:00,SITE_IND_001,3.968,235.1,50.02,OK
2025-01-26 01:15:00,SITE_RES_002,0.112,220.2,49.79,OK
2025-01-16 05:00:00,SITE_IND_001,1.743,237.8,50.09,OK
2025-01-27T03:45:00,SITE_IND_001,1.411,239.1,49.98,OK
22/01/2025 06:00:00,SITE_RES_001,0.126,238.0,49.85,OK
2025-01-30T19:45:00,SITE_RES_001,0.343,250.6,49.95,OK
2025-01-14T13:15:00,SITE_RES_002,0.092,225.1,50.16,OK
12/01/2025 08:15:00,SITE_IND_002,1.053,221.0,50.13,OK
2025-01-24 05:00:00,SITE_IND_002,1.205,235.0,49.63,OK
2025-01-27T00:15:00,SITE_IND_001,1.415,230.0,49.85,OK
2025-01-13T02:30:00,SITE_COM_002,0.146,222.7,49.78,OK
2025-01-01 11:15:00,SITE_COM_002,1.044,224.8,50.28,OK
19/01/2025 09:30:00,SITE_IND_001,1.649,227.1,50.17,OK
20/01/2025 04:15:00,SITE_RES_001,0.141,233.6,50.06,OK
2025-01-07T08:15:00,SITE_COM_001,1.31,234.7,50.08,OK
02/01/2025 03:30:00,SITE_RES_001,0.189,237.1,50.07,OK
2025-01-24T04:30:00,SITE_RES_002,0.132,231.6,50.06,OK
2025-01-12T00:15:00,SITE_COM_002,0.154,240.6,50.06,OK
2025-01-22 18:00:00,SITE_COM_001,0.977,218.3,50.1,OK
2025-01-11T12:45:00,SITE_IND_001,1.353,215.3,50.2,OK
2025-01-12T20:00:00,SITE_IND_002,1.091,229.3,49.87,OK
2025-01-24 16:15:00,SITE_RES_002,0.134,219.0,49.72,OK
2025-01-25 19:00:00,SITE_RES_001,0.305,230.7,50.23,OK
2025-01-24T14:45:00,SITE_IND_002,2.306,229.9,50.18,OK
2025-01-17T21:45:00,SITE_RES_001,0.191,213.6,49.82,OK
2025-01-22T16:15:00,SITE_COM_001,1.246,239.6,50.22,OK
2025-01-18T02:30:00,SITE_RES_002,0.14,229.7,50.25,OK
2025-01-10T06:15:00,SITE_RES_002,0.105,237.0,50.2,OK
2025-01-13T06:15:00,SITE_RES_001,0.181,229.2,50.38,OK
2025-01-30T07:45:00,SITE_RES_001,0.386,209.3,50.01,OK
15/01/2025 11:00:00,SITE_RES_001,0.153,239.7,50.12,OK
2025-01-10T23:30:00,SITE_IND_002,1.038,220.2,50.21,OK
2025-01-13T23:15:00,SITE_COM_001,0.212,233.8,50.23,OK
2025-01-28T03:30:00,SITE_COM_002,0.106,215.5,50.14,OK
2025-01-01 18:45:00,SITE_RES_001,0.407,220.3,50.24,OK
23/01/2025 02:15:00,SITE_IND_001,1.553,233.2,50.13,OK
2025-01-01T16:00:00,SITE_COM_002,1.209,216.1,49.67,OK
2025-01-13T05:30:00,SITE_IND_001,,234.9,50.0,ERROR
2025-01-11T13:45:00,SITE_RES_002,0.114,243.9,49.94,OK
2025-01-25T14:30:00,SITE_IND_002,1.248,238.3,50.06,OK
2025-01-21 09:15:00,SITE_RES_002,0.107,217.8,50.24,OK
2025-01-20 23:15:00,SITE_RES_002,0.106,224.5,50.03,OK
2025-01-14 22:45:00,SITE_IND_001,1.228,235.8,50.04,OK
11/01/2025 03:15:00,SITE_IND_001,1.269,228.2,50.01,OK
20/01/2025 13:30:00,SITE_COM_001,1.477,251.0,49.93,OK
2025-01-14T16:15:00,SITE_RES_001,0.156,225.5,50.22,OK
07/01/2025 13:30:00,SITE_IND_001,3.459,224.8,49.9,OK
10/01/2025 16:45:00,SITE_COM_002,0.824,223.8,50.17,OK
10/01/2025 22:45:00,SITE_COM_001,0.235,246.1,50.16,OK
2025-01-22T18:15:00,SITE_IND_001,3.592,223.3,49.77,OK
2025-01-03T05:15:00,SITE_COM_001,0.182,222.9,50.2,OK
25/01/2025 05:30:00,SITE_RES_001,0.19,220.5,50.15,OK
2025-01-27T16:30:00,SITE_IND_002,2.403,247.5,49.98,OK
27/01/2025 04:30:00,SITE_COM_001,0.204,231.1,49.86,OK
2025-01-11T22:45:00,SITE_RES_002,0.121,226.2,50.03,OK
2025-01-04T05:45:00,SITE_RES_001,0.176,247.7,50.21,OK
30/01/2025 05:00:00,SITE_IND_001,1.723,222.9,49.76,OK
2025-01-27T03:30:00,SITE_RES_002,0.118,215.6,50.22,OK
2025-01-29 10:30:00,SITE_COM_001,1.119,233.9,50.01,OK
2025-01-24 09:45:00,SITE_COM_001,1.295,236.1,49.71,OK
2025-01-04T14:45:00,SITE_RES_001,0.136,226.7,50.28,OK
2025-01-11 14:00:00,SITE_IND_002,1.051,236.9,50.05,OK
2025-01-04T04:30:00,SITE_COM_001,,214.8,50.1,ERROR
01/01/2025 10:45:00,SITE_IND_002,2.359,229.3,50.12,OK
2025-01-20T05:00:00,SITE_RES_001,0.128,226.0,49.94,OK
2025-01-18 09:45:00,SITE_RES_001,0.173,242.6,50.21,OK
2025-01-13 14:45:00,SITE_RES_001,0.142,226.3,50.04,OK
